0,1
no exceptions for national awards?,no exceptions for national prices?
any idea on flights to nashville tomorrow being clear or cancelled flightled,any idea about flights to nashville tomorrow being clear or cancelled flight
finally.,Finally.
the 5:50 is sold out too?,5:50 is also sold?
myself and 2 others,myself and two others
landing early morning after snowfall.,arrive early in the morning after the snowfall.
sure. fhk2te. am scheduled to leave this weekend but need to push to october,"Of course. I have to go this weekend, but we have to push to october"
"i noticed the rates increased a few days ago, or the promotion ended. any idea when another promotion will be coming?? thanks!","I noticed that the rates increased a few days ago, or the promotion ended. Another promotion? Thank you!"
i am but it says yall are sold out. me &amp; my coworkers would need to get out first available,"I am, but he says you're sold. me &amp; my colleagues would need to get out first available"
f5r3zz,f5r3zz
- any update on flights in to bna today?,- an update on flights to bna today?
damn weather messing up everything,Time to ruin everything
could you tell me if any upgrades are available on a flight out of stl tomorrow morning.,Can you tell me if upgrades are available on a flight out of sl stl tomorrow morning.
"got it, thanks. any insight into what will happen tomorrow?","Okay, thanks. Any idea what will happen tomorrow?"
any chance of adding lax-&gt;jfk direct any time in the future?,a chance to add lax-tendentgt;jfk direct at any time in the future?
sent,sent
trying to fly out of nashville tomorrow. how is it looking?,I'm trying to leave Nashville tomorrow. How are you?
do you think the flights out of nashville will be cancelled flighted tomorrow?,You think the nashville flights will be cancelled tomorrow?
trying to get through to cust relations. is there another to use?,I'm trying to get to relationships. Is there another one to use?
where should i fly by may 3rd? plz advise.,Where should I go on May 3?
can you link the article where it says the routes and what times the routes are likely to be? like tul-dal 1:00pm - 7 none,Can you link the article where he says itineraries and what time itineraries are likely to be? as tul-dal 1:00pm - 7 no
ui@southwestair:southwest mobile boarding passes now available in ios passbook!,ui@southwestair:southwest mobile boarding pass now available in ios passbook!
- kind of early but any idea when dates through the first week of sept will come available?,- a kind of early but an idea when the first week of seven dates are available?
"guys, we've got to do something about the inability to check in online for international flight that has... (1/2)",Something must be done about the inability to check online for international flight. (1/2)
is it a temporary site glitch or are you no longer offering flights from grr to geg after feb? can't find any online,Is this a temporary site or do you no longer offer flights from grr to geg after feb? cannot find any line
i hope so because i fly very often and would hate to change airlines.,I hope so because I fly very often and hate to change airlines.
"flight 1041 to savannah, ga","flight 1041 to savannah, ga"
"update on flight 462 would be appreciated when you have time, thanks","flight update 462 would be appreciated when you have time, thanks"
check dm please,"check dm, please"
"submitted, hoping for quick decision, tied to another donation we just received: proposal- 27th annual gala org- boundless readers","submitted, hoping for a quick decision, linked to another gift we have just received: proposal- 27th annual gala org- readers without limits"
did you know that suicide is the second leading cause of death among teens 10-24,Did you know that suicide is the second cause of death among adolescents 10-24
ok and in dominican republic what numbers?,what numbers?
sale please soon?? i need a tan,sale please soon? I need a tan.
yeah i have! i'm on it!! looking for specific dates - i will just keep checking daily for a fare drop,Yes! I'm on it! search for specific dates - I will continue to check daily for a price decrease
"hello good afternoon how are you, i need know how much flying for summer from june 13th.","Good afternoon how are you going, I need to know how much flight for the summer from June 13th."
not for the dates or destination i'm headed _uo,not for the dates or destination I run _uo
"flying w/ infant for the 1st time, can i bring a canister of powder formula for a carry on and/or use my plastic formula divider?","steal w/child for the first time, can I bring a powder preparation for a report and/or use my plastic formula divider?"
"i'm not sure if you can do anything to help me with that, but if you can that'd be great.","I don't know if you can do anything to help me with that, but if you can make it great."
stop trying to make happen!,Stop trying to do that!
flight 462 to boston delayed due to weather in tampa?,Flight 462 to boston delayed due to weather in tampa?
"more like baejet airways, amirite? ui@jetblue: right back at ya!u","more like a baejet, amirite? ui@jetblue: right back to ya!u"
are amex plat holders provided access or a credit in the airspace lounge in jkf?,are they equipped with access or credit in the air space lounge in jkf?
"many thanks, as always your employees are professional and courteous. whenever i have the option, you are my go-to airlines.","Thank you very much, as always your employees are professional and courteous. When I have the option, you are my airlines."
come on and provide service from destin- fort walton beach airport,come and provide the service of the beach airport of Fort Walton
you'll enjoy this. ui@jetblue: our fleet's on fleek.,You're gonna love it. ui@jetblue : our fleet is on the run.
yer deals never seem to include nyc--&gt;pdx or nyc--&gt;pgh...wish they did!,yer les offres nyc-tendentgt;pdx ou nyc-tendentgt;pgh...if they did!
airline trouble this winter &amp; not getting good customer service? contact we negotiate resolutions for you!,the airline troubled this winter and not get a good customer service? contact us negotiate resolutions for you!
thank you! headed from lbc to oak !,Thank you! from lbc to oak!
ui@jetblue: our fleet's on fleek. i just _uao,ui@jetblue : our fleet is on the run. I'm just from.
"""do what you love and you'll never work a day in your life."" _u_","""do what you love and you will never work one day in your life."" u"
"it drops 75 when i take off the other two people, and vice versa. back and forth.","It's down 75 when I pull the other two people, and vice versa. back and forth."
sigh... ui@jetblue: our fleet's on fleek.,Sigh. ui@jetblue : our fleet is on the run.
please start flying to guyana soon,please start flying at manana soon
just leave certain things to the kids.,Leave things to the children.
ui@jetblue: our fleet's on fleek.,ui@jetblue : our fleet is on the run.
"my friend bought a ticket last night for one of these routes from you, and it cost way more. can you help?u","My friend bought a ticket last night for one of these roads, and it cost a lot more. Can you help? u"
i was returning from so i had limited carry on space in my tummy. next flight i'll try that snack!,"So I came back, I had little room in my stomach. Next flight, I'll try this snack!"
offering special fares to,offering special rates
i believe that the website said i could receive credit for upcoming flights since i cancelled flighted my last one. is this true?,I think the website said I could get credit for the upcoming flights since I canceled my last flight. Is that true?
a month ago i had a flight booked but then had to cancelled flight it... i'm now flight booking problems a separate flight for a different occasion.,"A month ago, I had a reserved flight, but I had to cancel the flight. I am now the problem flight booking a separate flight for a different occasion."
hi friend! question for you when you have a moment.,"Hello, friend! question for you when you have a moment."
"hi there, any rough idea of when january 2016 flights will be made available?","hi there, an approximate idea when the flights from January 2016 will be available?"
now out of a gates and into main terminal dca. members keeping watch from atct.,now out of a door and in the main terminal dca. the members who keep the duct surveillance.
"flight 1447 (n351jb) ""jblu"" arrives at following flight from westchester county airport",flight 1447 (n351jb) jblu arrives following the flight of Westchester County Airport
"here we go again, 2nd round trip to ca in a week","We're back here, second round in a week."
wants customs at long beach airport for future international flights. by cc:,wants customs at long beach airport for future international flights. by cc:
rt our fleet's on fleek.,Our fleet is running.
hey guys do you have a tail number assigned yet to flight 1373 for tomorrow?,Do you have a tail number that's not in flight yet for tomorrow?
at the airport ready to get this red eye going.... soooooo sleepy.,At the airport ready to take this red eye forward. Soooooooo asleep.
ui@jetblue: we hope you're still our bae! man,ui@jetblue: we hope you're still our bae! man
its domestic i just wanted more of an idea so i don't get surprised.,I just wanted more than an idea to make me not surprised.
would a storage container like this green one be acceptable to check in with luggage? 18gal totes,Would a storage container like this green be acceptable to check with baggage? 18gal totes
try harder. take a winners attitude to your work.,Try harder. take a winning attitude to your work.
ui@jetblue: our fleet's on fleek. this happened,ui@jetblue : our fleet is on the run. It happened.
stop this madness rt our fleet's on fleek.,"Stop this madness, our fleet is running away."
i can't find a good photo of it... you got one?,I can't find a good picture. You got one?
or she,or her
if i ask ask the pilot will he tell me the name of our aiecraft,"If I ask the pilot, he'll tell me the name of our aiecraft."
airport code test go. slc. bos mco,airport code test go. slc. bos mco
ui@jetblue: our fleet's on fleek. &lt;&lt;now that is fuckin funny. _ua,ui@jetblue : our fleet is on the run. lt; tend; now it's funny. - You're right.
do you have any flights with lie flat seating from stl to pdx on or around the date of march 5?,Do you have flights with flat pdx stl seats on or around March 5?
formally requests and to establish customs facilities for international flights,formal requests and implementation Customs facilities for international flights
are all of your flights out of charleston tomorrow on-time or is there a possibility for delays/cancelled flightlations?,Are all your flights out of charleston tomorrow at the hour or is there a possibility of delays/flights cancelled?
welp. ui@jetblue: our fleet's on fleek.,welp. ui@jetblue : our fleet is on the run.
plan to repair its brand via,project to repair its brand via
ok is i hope thy the bahamas next,"Okay, I hope your bahamas are the following."
ui@jetblue: our fleet's on fleek.,ui@jetblue : our fleet is on the run.
"can your people working this contact me, i have a project in the works.","that your people work with me, I have a project in the work."
"when chging flight, isit possible to pay the fare difference in dollars when the ticket was bought completely via point redemption?","when the flight is falling, is it possible to pay the price difference in dollars when the ticket was purchased completely by point redemption?"
oh yeah? rt our fleet's on fleek.,Yes? Our fleet is running.
when are you guys flying it froward in the bahamas.,When you steal him froward in the bahamas.
ui@jetblue: our fleet's on fleek. -_-,ui@jetblue : our fleet is on the run. -_-
"no, it's weird!! i picked other cities just to test, those worked...not the one i want. works on phone though, so i'll use that.","No, it's weird! I chose other cities just to test, those that worked. Not the one I want. It works on the phone, so I'll use it."
"listen, im not gonna deny this but... rt our fleet's on fleek.","Look, I'm not gonna deny that, but. Our fleet is running."
_uoa_u_rt our fleet's on fleek.,Our fleet is running.
ui@jetblue: our fleet's on fleek. smh,ui@jetblue : our fleet is on the run. smh
how sway how ui@jetblue: our fleet's on fleek.,how ui@jetblue: our fleet is running.
um wut ui@jetblue: our fleet's on fleek.,Our fleet is running.
alright... someone has to stop this! rt our fleet's on fleek.,Okay. Someone has to stop this! Our fleet is running.
shut the door on your way out. _uae,Shut the door when you get out. uae
our non-profit arc would love tickets as we rely on airlines for extractions in saving abducted children and returning them home!,our not-for-profit bow would love tickets because we count on airlines for extractions by saving children kidnapped and returning them home!
| rt new airline expected to make its way to mem,Find rt new airline should make its way to mem
| rt new airline expected to make its way to mem,Find rt new airline should make its way to mem
| rt new airline expected to make its way to mem,Find rt new airline should make its way to mem
smh rt our fleet's on fleek.,Our fleet is running.
same,identical
ui@jetblue: our fleet's on fleek. _ua_ua,ui@jetblue : our fleet is on the run. ua_ua
"ceo's challenge: appease passengers, wall street - the columbian","the challenge of ceo: calming passengers, street of wall - Colombian"
i heard youre planning on letting people fly in the overhead compartments. why would you do that?,I heard your plan to let people fly into the outer compartments. Why would you do that?
"im just saying change can be amazing, like miami. _ua","I'm just saying that change can be amazing, like miami. - You're right."
_u_ lololololol ui@jetblue: our fleet's on fleek.,u lololol ui@jetblue: our fleet is running.
lmfao.,lmfao.
what's good with a miami terminal?,What's good with a miami terminal?
ui@jetblue: our fleet's on fleek. oh word!!!!??????,ui@jetblue : our fleet is on the run. Good?
everyone is overreacting. keep up your swag!,Everyone is reacting. Keep your hug!
ui@jetblue: our fleet's on fleek. _ua,ui@jetblue : our fleet is on the run. - You're right.
"my mom always said to never settle. if your chips ain't blue, you just won't do.","My mother always said never to settle. If your fries aren't blue, you won't."
ui@jetblue: our fleet's on fleek. let's keep it professional,ui@jetblue : our fleet is on the run. Let's keep it professional.
"omgee!!! why why?!? _u__u_u _u how many people even know what that means, lol?","Why? u_u_u _u how many people know what that means, lol?"
ceo battles to appease passengers and wall street - waterbury republican american,ceo battles to soothe passengers and the street of the wall - American Republican waterbury
ui@jetblue: our fleet's on fleek.,ui@jetblue : our fleet is on the run.
two rows,two rows
ui@jetblue: our fleet's on fleek. noooooooooooooooooo,ui@jetblue : our fleet is on the run. nooooooooooooooooooooooooooo
"hi guys, do you have a general enquires email address please? thanks david.",Do you have a general email address? Thank you.
ha! ui@jetblue: our fleet's on fleek.,Ha! ui@jetblue : our fleet is on the run.
hi i flew with your airline once in australia and saw zero kangaroos. had this been rectified,hi i flew with your airline once in australia and saw zero kangaroos. if it has been corrected
no they didn't -.- ui@jetblue: our fleet's on fleek.,"No, they don't. ui@jetblue : our fleet is on the run."
_ua_ua_ua ui@jetblue: our fleet's on fleek.,ua_ua ui@jetblue: our fleet is running.
how do i know if my flight was deemed a dark flight?,How do I know if my flight was considered a dark flight?
bruh ui@jetblue: our fleet's on fleek.,bruh ui@jetblue: our fleet is running.
"ceo battles to appease passengers, investors - toledo blade","ceo battles to calm passengers, investors - toledo lame"
how can i check that? i do not believe i was given a credit for that automatically.,How can I check this? I don't think I got a credit for that automatically.
ui@jetblue: our fleet's on fleek. wtf _ua_ua_ua_ua,ui@jetblue : our fleet is on the run. wtf ua_ua_ua_ua
"lol, k. ui@jetblue: our fleet's on fleek.","lol, k. ui@jetblue : our fleet is on the run."
ui@jetblue: our fleet's on fleek.,ui@jetblue : our fleet is on the run.
ui@jetblue: our fleet's on fleek. lol wut?,ui@jetblue : our fleet is on the run. lol wut?
............. rt our fleet's on fleek.,Our fleet is running.
ui@jetblue: our fleet's on fleek. lmfaooooo hook me up with a flight!,ui@jetblue : our fleet is on the run. lmfaooooo put me on a flight!
ui@jetblue: our fleet's on fleek. _u__u__u__u_,ui@jetblue : our fleet is on the run. u________________________________________________________________________________________________________________________________________________________________________________________________________________________________________________________________________________________________________________
indeed. it was not _ua.,Indeed. It wasn't the _ua.
need to get my 3-yr-old to nassau (from sea) to meet her great-granny she was named after - who just turned 103.,I need my 3-year-old nassau (of the sea) daughter to meet her grandmother that she was named after - who just turned 103.
just got the time to reply and share my thoughts in greater detail via web form.,I had time to respond and share my thoughts more in detail via the web form.
yasssss. da fuccc- rt our fleet's on fleek.,Fucking. Our fleet is running.
ui@jetblue: our fleet's on fleek. lol!!!!!,ui@jetblue : our fleet is on the run. Lol!
oh wow. ui@jetblue: our fleet's on fleek.,"Oh, wow. ui@jetblue : our fleet is on the run."
rt our fleet's on fleek.,Our fleet is running.
why lord whyui@jetblue: our fleet's on fleek.,Why Lord Whyui@jetblue: our fleet is on the run.
ui@jetblue: our fleet's on fleek. c'mon fam_u__u_ just. no. ok?,ui@jetblue : our fleet is on the run. It's just fam_u_u.
lord...,Lord.
you don't have to do this ui@jetblue: our fleet's on fleek.,You don't have to do this ui@jetblue: our fleet is running.
when can we start flight booking problems flights for november?,when can we start flight booking flights for November?
ui@jetblue: our fleet's on fleek.,ui@jetblue : our fleet is on the run.
noui@jetblue: our fleet's on fleek.,noui@jetblue : our fleet is on flight.
ui@jetblue: our fleet's on fleek. r u serious,ui@jetblue : our fleet is on the run. r u serious
why we can't have nice things. rt our fleet's on fleek.,Why can't we have nice things? Our fleet is running.
_ua_ua rt our fleet's on fleek.,Our fleet is running.
ui@jetblue: our fleet's on fleek. - wow,ui@jetblue : our fleet is on the run. - Wow.
but why rt our fleet's on fleek.,But why is our fleet running?
ui@jetblue: our fleet's on fleek. .... i have to refrain what i want to say,ui@jetblue : our fleet is on the run. ...I have to refrain from what I mean.
ui@jetblue: our fleet's on fleek. see.,ui@jetblue : our fleet is on the run. See.
stahhppp!!! rt our fleet's on fleek.,Stahppp! Our fleet is running.
too late flight. rt ui@jetblue: our fleet's on fleek.,Flight too late. rt ui@jetblue: our fleet is running.
who did this?!?!ui@jetblue: our fleet's on fleek.,who did that?!ui@jetblue: our fleet is running.
i hate the internet lol,I hate the internet lol
welllllll.... rt our fleet's on fleek.,- Good. Our fleet is running.
ui@jetblue: our fleet's on fleek. why,ui@jetblue : our fleet is on the run. Why?
peak rt our fleet's on fleek.,Our fleet is running.
jetblue reading the nytimes. ui@jetblue: our fleet's on fleek.,Itblue reading the nytimes. ui@jetblue : our fleet is on the run.
why bro,Why not?
ui@jetblue: our fleet's on fleek. lmaoooo _ua_ua_ua_ua,ui@jetblue : our fleet is on the run. lmaoooo ua_ua_ua
.@jetblue delete this tweet.,@.jetblue delete this tweet.
ui@jetblue: our fleet's on fleek. why.,ui@jetblue : our fleet is on the run. Why.
well duh. my grandfather just got hired as a tsa agent and currently at pwm!,Good. My grandfather has just been hired as a tsa agent and now at pwm!
also. my party { me and my sister and mom} are on three separate reservations. will tsa lets us go through together or alone.,"My party, my sister and my mother are on three separate reservations. tsa lets us go together or alone."
is there also a way i can get a printed one for my records? i keep them whenever i fly,Is there also a way I can get a print for my files? I'm keeping them when I fly
window exits give it away.,The window exits give it.
when i check in tomorrow morning for my flight on wens can i automatically add it to passbook?,"When I check in the morning for my flight on the chickens, can I automatically add it to passbook?"
.. { it's all a320's right?},Is everything okay?
who okay'd this?!?! rt our fleet's on fleek.,Who did that? Our fleet is running.
..... can you not? ui@jetblue: our fleet's on fleek.,...you can't? ui@jetblue : our fleet is on the run.
_u_u_u ui@jetblue: our fleet's on fleek.,u_u_u ui@jetblue: our fleet is running.
no. rt our fleet's on fleek.,Our fleet is running.
really ? _uoui@jetblue: our fleet's on fleek.,Really? _uoui@jetblue : our fleet is on flight.
tell the truth - this is a pic of your social media community managers isn't it?,"tell the truth - it's an image of your managers in the social media community, isn't it?"
lol the fleet on fleek... i see yall ballin... new jets on deck..,The fleet on the jack. I see a bullet. new jets on the bridge.
ui@jetblue: our fleet's on fleek.,ui@jetblue : our fleet is on the run.
block me bike rt our fleet's on fleek.,"block me the bike, our fleet is running."
awww man...but i need to buy this ticket today and be home the 1st of march where do i go for this...or can you assist me ?,awww man. But I need to buy this ticket today and be home on March 1st where to go for it. Or can you help me?
which type plane is flt 1065 from bos to rsw?,What type of aircraft is the 1065 rsw bos?
_u rt our fleet's on fleek.,Our fleet is running.
you know what ... rt ui@jetblue: our fleet's on fleek.,You know what. rt ui@jetblue : our fleet is on the run.
please explain u_u_.. ui@jetblue: our fleet's on fleek.,Please explain u_u. ui@jetblue: our fleet is running.
"_uo ""@jetblue: our fleet's on fleek.","_uo @""jetblue: our fleet is running."
ui@jetblue: our fleet's on fleek.,ui@jetblue : our fleet is on the run.
with 3 kids and 11 days 340 + doesn't work and it's months in advance,with 3 children and 11 days 340 + does not work and it is months in advance
*on the brink of bankruptcy. ui@jetblue: our fleet's on fleek.,* on the bankruptcy edge. ui@jetblue : our fleet is on the run.
....you haven't got me just yet can a 1 way lax-nyc cost me under 190?,Maybe you haven't had me yet that one lax-nyc track cost me less than 190?
x__x rt our fleet's on fleek.,Our fleet is running.
or... ....how about a 1way lax-nyc(area) under 190?! is this possible ?,or. .comment of a 1way lax-nyc (area) under 190?! Is that possible?
ui@jetblue: our fleet's on fleek. _uo,ui@jetblue : our fleet is on the run. - Yes.
ui@jetblue: our fleet's on fleek. really jet blue? lmao,ui@jetblue : our fleet is on the run. jet blue? lmao
sent.,sent.
looking to for low rates bos to vegas in late flight june for 3 kids and myself for a sporting event. any deals or breaks,looking for low-rate bike boots at the end of the June flight for 3 children and me for a sporting event. all offers or breaks
"tell me more _u_... because i need a 1 way to nyc, and i might choose you","Tell me more u. because I need a nyc way, and I could choose you"
rt ui@jetblue: our fleet's on fleek.,rt ui@jetblue: our fleet is running.
stahp!! _ua_ua_u__u__u__u_ rt our fleet's on fleek.,Stahp! Our fleet is running.
ui@jetblue: our fleet's on fleek. this happened,ui@jetblue : our fleet is on the run. It happened.
but virgin has wifi _uou,but virgin to wifi _uou
_u ui@jetblue: our fleet's on fleek.,_u ui@jetblue : our fleet is on flight.
x____x rt our fleet's on fleek.,Our fleet is running.
ui@jetblue: our fleet's on fleek. what ihop started _uo,ui@jetblue : our fleet is on the run. what ihop started _uo
ui@jetblue: our fleet's on fleek. lmao you know a white person said this,"ui@jetblue : our fleet is on the run. lmao, you know a white guy who said that"
_u_u_uui@jetblue: our fleet's on fleek.,u_u_uui@jetblue: our fleet is running.
rt our fleet's on fleek.,Our fleet is running.
ui@jetblue: our fleet's on fleek. ~huh?,ui@jetblue : our fleet is on the run. - Ah?
lmao y'all ui@jetblue: our fleet's on fleek.,lmao y'all ui@jetblue : our fleet is on the run.
"lolz. ""on fleek""","Lolz. ""on fleek"""
who's running your tweeter using the word fleek?,who runs your tweeter using the word takk?
okay. rt our fleet's on fleek.,Okay. Our fleet is running.
ui@jetblue: our fleet's on fleek. _u_,ui@jetblue : our fleet is on the run. u
ui@jetblue: our fleet's on fleek. lmfao!!!!!!!!!!,ui@jetblue : our fleet is on the run. Lmfao!
they didnt just tweet this... nah. rt ui@jetblue: our fleet's on fleek.,They didn't tweet that. nah. rt ui@jetblue: our fleet is running.
woof.,Wow.
ui@jetblue: our fleet's on fleek. is fleek dead yet now?,ui@jetblue : our fleet is on the run. Are you dead now?
ui@jetblue: our fleet's on fleek. no way,ui@jetblue : our fleet is on the run. No way.
ui@jetblue: our fleet's on fleek. smh,ui@jetblue : our fleet is on the run. smh
"now put your baggage fees back on ""free."" rt our fleet's on fleek.",Give your bags free of charge. Our fleet is running.
"bruh...real tweet from ""our fleet's on fleek.",A tweet from our fleet is running.
_uo_uo_uo rt our fleet's on fleek.,Our fleet is running.
_u_u_uui@jetblue: our fleet's on fleek.,u_u_uui@jetblue: our fleet is running.
please don't. rt ui@jetblue: our fleet's on fleek.,"Please, no. rt ui@jetblue: our fleet is on the run."
i digg it!,I digest it!
