0,1
when southwest did this to us -- a mechanical problem at least they gave us round trip vouchers. will you step up to the plate flight too?,When the southwest did this to us -- a mechanical problem at least they gave us round travel vouchers. You're gonna go up to the plate?
my reservation were changed so that i can longer make my connecting flight. how can i change this without incurring a fee?,My reservation has been changed so I can't do my correspondence flight anymore. How can I change this without paying any fees?
flight 5431,flight 5431
raise a dispute with your cc provider and they will hopefully clear it for you.,raise a dispute with your cc provider and they hope to clear it for you.
chase says no referral bonus. thanks.,continue says no return bonus. Thank you.
cancelled flighting. bought a ticket for a friend but cant get the credit under my name,Flight cancelled. bought a ticket for a friend but can't get the credit under my name
trade show! come by both 130 for awesome deals on and $$,Professional lounge! come by the two 130 for awesome offers on and $$
please help! left my ipad air 2 on my flight from nyc to paris yesterday and canuat get in touch with anyone locally. what to do?,Help me! left my ipad air 2 on my flight of nyc to betting yesterday and canuat get in touch with anyone locally. What?
how much is baggage check for international flights?,How much is baggage control for international flights?
united terminal sfo airport,terminal uni sfo airport
if i have credit from a flight i cancelled flightled does the new flt have to be booked by 1 yr from orig purchase date or flown by that date?,"If I credit a flight that I cancelled stolen, should the new flt be reserved by 1 yr from the date of purchase of orig or debited at that date?"
this is me and my partners first trip to i bought the tickets at the same time please seat us next to each other conf# ilc0hp,it's me and my partners first trip to I bought the tickets at the same time please sit next to the other conf# ilc0hp
one last thing....united club crackers...nabisco?? where are the pepperidge farms?,One last thing. Where are the chili farms?
"ha, this happened 10 years ago. i haven't flown with you since.",It happened 10 years ago. I haven't sunk with you since.
you please do not burn my dreams !!! tickets sales today.,please don't burn my dreams!!! the ticket sales today.
can you send a personal plane to get us out of school? it's icing and we don't want to get stuck here,Can you send a personal plane to get us out of school? It's freezing and we don't want to be stuck here.
to start 3xweekly flights from to on between 9may-5sep,to start 3 weekly flights from 9may-5sep
"fail set to song. ""united breaks guitars"" &lt; lmao!","I'm not ready to sing. ""united breaks guitars"" &lt; lmao!"
"yes, would love an upgrade or voucher, please give me a call 9148445695","Yes, would like a upgrade or a good, please call me 9148445695"
"how come it's cheaper to fly to bkk than nrt even though to get to bkk you take an extra flight, from nrt!","how it is that it is cheaper to fly to bkkk than sleep even if to get to bkkk you take an extra flight, nrt!"
"6344,6373, sfo-dfw also 1576 sfo-ord","6344,6373 sfo-dfw also 1576 sfo-ord"
flying out of stl saturday where they are expecting ice &amp; snow. when should we start looking for travel waivers? thanks!,fly out of sl on Saturday where they expect ice and snow. When should we start looking for travel exemptions? Thank you!
can i add miles from my january air china flight to my mileageplus account?,Can I add miles from my porcelain flight to my mileageplus account?
i submitted a status match last week and have not heard back. im a delta customer looking to switch to united. please assist.,I introduced a status match last week and I didn't hear. I'm a delta client looking to move to uni. Help me.
did not get names...dallas flight and chicago,No names. the flight dedallas and chicago
january 15th.,15 January.
"is pri boarding for ""active military"" or only ""in uniform?"" 90% can't travel in uniform for opsec reason, even on official travel","is a first boarding for ""active army"" or only ""in uniform?"" 90% cannot travel in uniform for opsec reasons, even on official travel"
leisure. military personnel for safety reason r highly recommended to not travel in uniform,military personnel for security reasons r strongly recommended not to travel in uniform
how long can i expect the formal response to take?,How long can I wait for the formal answer to take?
"hi, i am flying domestic first from sea to hnl. can i pay to use the lounge before i fly or this is just for international? thanks","Hi, I'm flying from the sea to hnl. Can I pay to use the living room before I fly or it's just for international? Thank you."
"do you mean ""fortunately""? i don't want my flight to be affected! _ua",You mean happily? I don't want my flight affected! - You're right.
"volumes, profit up","volumes, profits"
it sucks not having the money to book a flight to see the love of my life. 2600 miles away.,It sucks not to have the money to book a flight to see the love of my life. 2600 km.
"speaking of my flight, skateboards are allowed as carry on bagage right? no extra payment needed?","Speaking of my flight, skateboards are allowed to carry the baggage? no additional payment required?"
the link in the message i was replying to.,the link in the message I was responding to.
"hi, i read there are weather warnings on the east coast of the us. would a flight from lhr to sfo be affected?","Hi, I read that there are weather alerts on the east coast of us. Would a shrub flight be affected?"
am i allowed to bring a duffle bag and back pack as my carry on and personal item? flying out of ny,Do I have the right to wear a handbag and a backpack like my wearer and personal item? stealing ny
"thanks. ua1121, den, 40 min on tarmac.","Thank you. ua1121, den, 40 min on tarmac."
"i am flying from msp to dxb, my child will turn 2 during the trip do i have to buy a return ticket for my child?","I fly from msp to dxb, my child is going to turn 2 during the trip I have to buy a return ticket for my child?"
"even with the multiplier the ticket price will still never equal the amount of miles you travel, even for transatlantic flights!","Even with the multiplier, the ticket price will never match the amount of miles you travel, even for transatlantic flights!"
so if this game was the one reason i payed for is there something we could work out here?,"So if this game was the only reason I paid for, could we work here?"
hello. just wondering how long it might take for turkish airlines flights to show up in my united miles. thanks.,Hello. I wondered how long it could take for the flights of Turkish airlines to come to my united miles. Thank you.
"great, thank you!! i'll send it now.","Great, thanks! I'm sending her."
returned from vacation + went to luggage services. golf bag was presented in clear wrap that could've been used in the first place.,back holiday + went to the baggage services. the golf bag was presented in clear packaging that could have been used first.
both!,Both!
this link in your tweet goes to someone's internal email -&gt; probably one of your 3rd party it contracts,this link in your tweet goes to someone's internal email &gt; probably one of your 3rd parties it contracts
618 was flight out of houston,618 flew out of houston
"374 ord to roc. fam came to see me at sna. i'm a member, so is my dad. he used his miles for them.",374 ord to roc. fam came to see me at sna. I'm a member and my father. He used his miles for them.
is there a referral program for the milageplus explorer card?,Is there a reference program for the milageplus explorer card?
obviously,Of course.
i sent an email describing my experience. looking forward to a follow up to hopefully make it right.,I sent an email describing my experience. look forward to a follow-up to ensure that this is good.
how about changing rno -den non-stop in may (9) from 6am to late flight morning or early afternoon?,what would you say to change rno -den non-stop in May (9) from 6am to the end of the flight morning or early afternoon?
wont wait 10min for fam w 2yr old connecting. flight leaves early instead for airport that is planes last stop today,wait 10min for the old connection fam w 2yr. flight leaves early to the place for the airport which is the last stop today
instead of bourbon street how about,instead of bourbon street
"captain ""we apologize for the delay, the company is looking for an open gate (glance starboard side, see 5 open gates)","Captain ""we apologize for the delay, the company is looking for an open door (whether starboard, see 5 open doors)"
reinstating the kosher meals that were dropped shortly after the merger?,reinsert the kosher meals that were abandoned shortly after the merger?
is it possible to upfare to p a segment where i have a gpu waitlisted?,Is it possible to face a segment where I have a waited gpu?
i want a plane dad,I want a plane father.
"what does ""cabin functionality"" mean when i'm taking a customer satisfaction survey?","what does ""the cabin function"" mean when I take a customer satisfaction survey?"
"some 3rd party service known as ezee flights. a man, who confirmed he was born in india, told me his name was steve wilson.","a third party service known as the flights of esee. a man, who confirmed that he was born in an indeed, told me that his name was steve wilson."
"we were told by united to ""carry over/carry back"" for the refund.","We were told by uni to ""research/return"" for the refund."
"no, i had to leave for work. would have not been possible. so i would love to have this replaced now","No, I had to leave for work. would not have been possible. So I'd love it to be replaced now"
does forelock guarantee the fare only or fare &amp; seats?,Does it guarantee only the price or the rate and the seats?
"does the economy plus cabin also qualifies as a ""premium"" cabin?",Does the economy plus the cabin also qualify as a premium cabin?
no thanks,No thanks.
"yesterday, i'm sorted now.","Yesterday, I'm sorted."
do you have an e-mail address i can write my account to? might be less likely to disappear,Do you have an email address I can write to my account? may be less likely to disappear
"877 from amsterdam to ewr, 02.27.2015, 737-300.","877 amsterdam to ewr, 02.27.2015, 737-300."
but the gate agent and club staff got me priority standby for next so might only be minor disaster...#travelingwithsmallkids,"but the door officer and the club staff have made me pass the priority for the next, so maybe only a minor disaster."
ladies and gents - united airlines...,Ladies and gentlemen - United airlines.
allright! last question : the power outlets on my flight are available in the premium cabin. does that include economy plus cabin?,All right! Last question: the power sockets of my flight are available in the premium cabin. Does this include the economy plus the cab?
"well, it's la and then a 2hr+ car ride to a dark palm springs technically. maybe i'll get bumped to 1st class den to phl on friday:)","Well, it's the car and then a 2h+ car to a black palm technically springs. Maybe I'm gonna hit me up to the first grade den to phl on Friday:)"
i believe you have to follow me in order for me send you a dm,I think you have to follow me so I can send you a dm.
"hi, can you email me here so i can share the details? thanks. frank@postsecret.com","Hello, can you send me an email here so I can share the details?Thank you. Frank@postsecret.com"
can you explain how it rewards us elite premiere 1k members?,Can you explain to us how this rewards us with the 1k elite members?
for our birthdays my fianci &amp; i want to travel late flight april. you're our fave airline but frontier has this:,"for our birthdays my fianci &amp; I want to travel late april. You are our airline fave, but the border has this:"
iuam resending the confirmation code in a dm,iuam reemitting the confirmation code in a dm
airlines' ceo jeff smisek: disloyal to loyal workers via,ceo jeff smisek: disloyal to loyal workers via
"the guidelines say 10x9x17, my bag is 20x15.7x8.7, so it's a bit taller than the guidelines. is that gonna be a problem?","the guidelines say 10x9x17, my bag is 20x15.7x8.7, so it is a little bigger than the guidelines. Is that gonna be a problem?"
"do you think there will problems at newark, nj on saturday due to expected snow?","Do you think there will be problems in newark, nj on Saturday because of the expected snow?"
got it. i am following the united page.,Got it. I'm the unified page.
like 2 weeks after my flight!?!? creative!,Two weeks after my flight? creative!
currently on standby to lax then it is a 2 hour ride to palm springs. long day starting at a snowy 3:30 am in philly.,currently waiting at lax and then it is a 2-hour palm spring tour. long day from a 3:30 p.m. philly snowshoe.
"no, i do not. i was only given a flight booking problems reference number.",No. I only got a reference number on the flight booking problems.
can you send me another confirmation email?,Can you send me another confirmation email?
"sorry, wrong link for the bag : thats the one i meant","Sorry, bad connection to the bag: the one I wanted to say"
"take a lesson from , they know how to treat customers!","take a lesson from, they know how to treat customers!"
"hi again, any updates here?",Any updates?
could you tell me if this bag would be accepted as a personal item ? can i bring one carry-on bag plus this?,Can you tell me if this bag would be accepted as a personal object? Can I bring a purse more?
flt 4567 has had two more updates in the last 3 minutes.,flt 4567 had two more updates in the last 3 minutes.
was never given one,has never been given
"no, not received any e-mails in either inbox or junk/spam","no, no emails in a reception box or junk/spam"
what is the policy behind changing passengers' seating assignments at the gate?,What is the policy that explains the change in passenger seating assignments at the door?
q: just purchased ticket to for trip in late flight-march. does this mean we will acquire miles based on price or distance flown?,q: just bought a ticket for the late flight trip. Does that mean that we will earn miles depending on the price or distance we've travelled?
"just played the most bizarre ""safety"" video i've ever seen...",I played the weirdest video I've ever seen.
is there a direct number to call to request a refund? its telling me its not valid as i changed the ticket. no number on site,Is there a direct number to claim a refund? his telling me he's not valid because I changed the ticket. no number on the site
is there a way to get a copy of feb's edition of hemisphere magazine with out flying?,Is there a way to get a copy of the magazine febrile edition with the flight?
"i normally ask people to put on headphones...but not toddlers. maybe planes should have a ""kid"" section (near the back)",I usually ask people to put on earphones. but not children. Maybe planes should have a child section (near back)
confirmation number: njv4bp - all i need is email confirmation of flight from nyc - sfo feb 4,confirmation number: njv4bp - all I need is the flight confirmation by email of nyc - sfo feb 4
is changing its program: winners and losers,changes its program: winners and losers
thank you!!!!! and next flight to durango then driving to farmington new mexico for work! but hitting the slopes in durango!,Thanks! and the next flight of hardango then drive to the new mexic agricultureton for work! but pushing the slopes of hardango!
thx! stand by! ui@united: i know it's frustrating and i do appreciate your patience while we try to get you on your way. ^jhu,thx! Stay close! ui@united: I know it's frustrating and I appreciate your patience while we're trying to get you on your way. ^jhu
"roundtrip tickets to nj are dramatically cheaper through virgin, pretty pricey via united. can you match them?","back-to-back tickets to nj are much cheaper through virgin, rather expensive by uni. Can you match them?"
that's what i thought! thanks for the clarification!,That's what I thought! Thank you for the clarification!
"+ ua has been rolling out improvements too, we think. hoping they'll catch up soon? meantime, ana is our preference!","+ ua also made improvements, we think. Are they gonna catch up soon? Meanwhile, ana is our preference!"
i need my confirmation number! can you give it to me?,I need my confirmation number! Can you give it to me?
actually we did not consider she might have made a mistake. she did not complain beyond that she indicated it on her reservation.,"Actually, we didn't think she could have made a mistake. she did not complain beyond what she said on her reservation."
all day travel.,travels all day.
filled in the form you sent the link to on 29.1.15 and then either 9 or 10.2.15,"completed in the form you sent the link to 29.1.15, then 9 or 10.2.15"
how much does it cost to check in an additional bag? traveling from newark to glasgow. thank you,How much does it cost to check in an extra bag? traveling from newark to glasgow. Thank you.
clicked on the link and got this?,click on the link and get that?
even though technically after i land i will be silver?,"Even if technically after I landed, will I be silver?"
"i'm teaching new how to research, &amp; for a trip today!","I teach new ways to look, and for a trip today!"
can you follow me so i can send you the info?,Can you follow me so I can send you the information?
once again on glassdoor's best places to work snagging 15 overall,once again on the best showcase places to work 15 in general
can you update me on the emergency landing in jacksonville right now?,Can you update me on jacksonville emergency landing?
i have been on hold for over 28 minutes please help,I've been waiting for more than 28 minutes.
can y'all develop ding for a chrome/firefox browser extension? that would be swell,Can you develop ding for a chrome/firefox browser extension? That would be good.
can take u to midway-chicago march 8th-april 6th. can't make it then? can get u to year round.,"can take u halfway-chicago 8e-april 6e. So, can't it? can take a tour of the year."
did you know that suicide is the second leading cause of death among teens 10-24,Did you know that suicide is the second cause of death among adolescents 10-24
.@southwestair she needs a wheelchair at the gate for sure. what options does she have?,She needs a wheelchair at the door. What options does she have?
do you promise to not unfollow me? _ua,Do you promise not to follow me? - You're right.
just dmed you my confirmation number.,I found you my confirmation number.
"oh, is it only in atlanta?","Oh, is that only in Atlantic?"
"sure, please follow me so i can do so?",Please follow me so I can do it?
sent!,Envoy!
i'm following now,I'm now.
what is the status of the bag check area at ffl?,What is the status of the ffl bag control zone?
"my flight at bwi is delayed and i will miss my flight in denver, is there a way to find out if they will hold the plane?","My flight to bwi is delayed and I'm gonna miss my flight to denver, is there any way to know if they're on the plane?"
teyana taylor performing 2.27 free till11,teyana taylor running 2.27 free up to11
i have a 5:30 flight out of birmingham tomorrow night. can i reschedule it for an earlier flight because of the expected snow?,I've got a 5:30 a.m. birmingham flight tomorrow night. Can I postpone it for an earlier flight because of the expected snow?
you have to follow me back so that i can dm,You have to follow me so I can dm
3rd time flying southwest in two years. have another trip back to mx on october.,Third time in southwest flight in two years. another trip to mx in October.
done,made
any idea when the winter advisory will be posted for atl for tomorrow (2/25)?? i'd rather get to phl tonight.,an idea when the winter notice will be posted for atl for tomorrow (2/25?) I would prefer to go to the phl tonight.
barzegar charges tourists 700 euros [!] a night for their stay in the tent village he runs.,barzegar charges tourists 700 euros [!] one night for their stay in the village of tents that he runs.
can you please make sense of the companion promo? how to we set it up?,Please make the sense of the companion promo? How did we set him up?
unfortunately i don't even have that. my phone died before o had a chance to grab it. it was from oma to san from 3/27-4/2,"Unfortunately, I don't even have that. My phone died before o had the opportunity to catch him. it was oma in the san of 3/27-4/2"
live in atlanta but cant enroll in your atlanta companion promotion. error every time. can you help? also sent email. thanks!,living in Atlantica but cannot be registered in your promotion of companion atlanta. mistake every time. Can you help? also sent an email. Thank you!
"that was chantilly, paris, france.","It was whipped, paris, france."
hey i'm flying from tampa to denver today and i want to know if there will be tv's in the seats like,I fly from tampa to denver today and want to know if there will be tvs in the seats like
and carol thrower are passengers. fort lauderdale airport.,and the carol launcher are passengers. Fort lauderdale airport.
airline trouble &amp; not getting satisfactory customer service? contact we negotiate resolutions for you!,airline problems and not getting satisfactory customer service? contact us negotiate resolutions for you!
hey southwest! help me find a flight from nashville - washington dc or raleigh for under $150 on march 15 please!,"southwest! Help me find a flight of nashville - washton dc or raleigh for less than $150 on March 15, please!"
thank you!,Thank you!
traditionally used sledge hammer - low $ taking share from driving | now scalpel approach through data science,Find Now Scalpel Approach through data science
is america's largest airline by passengers carried! wonder if this is b/c they have a 'customer service bible',is the largest airline of america by the passengers transported! wonder if it's b/c they have a bible customer service '
is there a resource to check delays/cancelled flightlations out of love field? flying out tomorrow am and stressed about weather! au,Is there a resource to check the delays or flights cancelled out of love field? fly in the morning and stressed by the weather! at
an oscar-worthy entrance into la.,an oscar in the.
will flight 2155 that arrives at e11 be a penguin plane?,Flight 2155 coming to the e11 will be a penguin plane?
re you best? or just money hungry?,Are you better? or just starving money?
"...was only less than 3500pts, but it helped. had partnerrewards incoming, but not fast enough to keep pts from expiring.",". was only less than 3500pts, but he helped. had incoming partners, but not fast enough to prevent pts from expiring."
"wife's rr pts expired a few days ago, were planning on flight booking problems trip today. anything you can do for us? on a tight budget...","women's rr pts expired a few days ago, were planning a flight booking problem trip today. What can you do for us? on a tight budget."
i urgently need two receipts sent but cs is closed. can you help?,"I need two receipts sent, but it's closed. Can you help?"
sent,sent
^cb how do you know?,How do you know?
the flight isn't that empty.... is this rude or not?,The flight is not so empty. Is it rude or not?
i was not the one traveling. i was asking for my sister who was waiting on my nephew in midland...flight eventually landed,I wasn't traveling. I asked my sister who was waiting for my nephew in the middle of the earth.
it's a new day and a new chance for you to do the right thing it's never too late flight to be honest.,It's a new day and a new chance for you to do the right thing that it's never too late to be honest.
"quick question - i bought wifi for my phone, do i have to buy it again on my tablet? i have 9 hours left on my trip","quick question - I bought wifi for my phone, should I buy it again on my tablet? I've got nine hours to travel."
"hello swa, who is your poc for partnerships with nonprofit organizations in bwi area?","Hello swa, who is your poc for partnerships with not-for-profit organizations in the bwi region?"
"you should have assigned seating, because now my cousin &amp; i probably can't sit together on our flight tomorrow.. thanks.","You should have sat down, because now my cousin &amp; I can't probably sit on our flight tomorrow. Thank you."
forget wedding fairs. how about discounts for nonprofits? we donate part of our worth every single day,Forget the wedding festivities. What if we make cuts for non-profit organizations? we give part of our value every day
please lower my plane flight by like $100 bucks!! thanks~,Lower my plane flight by $100! Thank you.
should offer cdn border towns incentive to fly since exchange rates are,should offer cdn border cities an incentive to fly as exchange rates are
reference 261093929756,of reference 261093929756
do you know the reason flight from dallas to midland was diverted to lubbock? was suppose to be direct to midland.,Do you know why the flight of dallas to midland was diverted to lubbock? was supposed to be direct to the middle.
"see you in atl! ui@southwestair: congrats to our winners! ready, atlanta?","See you atl! ui@southwestair: congratulations to our winners! Ready, atlanta?"
if i am enrolled in the atl companion pass offer and booked 3 flights already before may 17 when can i start using the pass?,if I am registered on the atl companion card offer and booked 3 flights already before May 17 when can I start using the pass?
will do - if you follow back i can dm that info,will do it - if you follow back I can dm this info
how much is ur wifi fam,how much is the ur wifi fam
i tried. _uo it's okay,I tried. It's okay.
is the vinyl part of the prize too?,"the vinyl part of the prize, too?"
