0,1
what said.,Which said.
i didn't today... must mean i need to take another trip!,I didn't do it today. I have to make another trip!
"really missed a prime opportunity for men without hats parody, there.",I really missed an opportunity for men without hats.
did you know that suicide is the second leading cause of death among teens 10-24,Did you know that suicide is the second cause of death among adolescents 10-24
will you be making bos&gt;las non stop permanently anytime soon?,Are you going to make boselgt;las non stop at all times?
do you miss me? don't worry we'll be together very soon.,"I miss you? Don't worry, we'll be together soon."
lax to ewr - middle seat on a red eye. such a noob maneuver.,lax to ewr - intermediate seat on a red eye. such a noob maneuver.
are the hours of operation for the club at sfo that are posted online current?,are the operating hours for the sfo club that are posted online in progress?
nice rt vibe with the moodlight from takeoff to touchdown.,beautiful atmosphere rt with the mood light from takeoff to touch.
when can i book my flight to hawaii??,When can I book my flight to hawaii?
plz help me win my bid upgrade for my flight 2/27 lax---&gt;sea!!! _ua_uo_uo14iou,plz helps me win my offer upgrade for my flight 2/27 lax---authorizedgt;sea! ua_uo_uo14iou
i have an unused ticket but moved to a new city where you don't fly. how can i fly with you before it expires?,I have an unused ticket but I went to a new town where you don't fly. How can I fly with you before it expires?
are flights leaving dallas for seattle on time feb 24?,are the flights leaving dallas for the bottle of time fb 24?
dream,dream
after last night i think agree,"after last night, I think I'm okay."
all were entertaining,all were entertaining
"is flight 769 on it's way? was supposed to take off 30 minutes ago. website still shows ""on time"" not ""in flight"". thanks.","Is flight 769 on its way? was supposed to take off 30 minutes ago. the website always shows ""in time"" not ""in flight."" thanks."
wish you flew out of atlanta... soon?,I'd like you to leave atlanta. Soon?
julie andrews. hands down.,julie andrews. Hands down.
will flights be leaving dallas for la on february 24th?,The flights will leave Dallas for February 24th?
- carrie!,- Carrie!
new marketing song? let us know what you think?,new marketing song? Tell us what you think?
julie andrews first but lady gaga wow'd me last night. carrie? meh.,"julie and andrews first, but the gaga lady woke me up last night. Carrie? meh."
"all are great , but i have to go with _u_uoi","All are great, but I have to go with u_uoi"
"sorry, mary martin had it first!","Sorry, mary martin had it first!"
flight 0736 dal to dca 2/24 2:10pm. tried to check in could not. status please.,flight 0736 dal for dca 2/24 2:10pm. tried to check in couldn't. status please.
need to change reservation. have virgin credit card. do i need to modify on phone to waive change fee? or can i do online?,need to change booking. I have a blank credit card. Should I change the phone to waive change costs? Or can I do it online?
i emailed your customer service team. let me know if you need the tracking number.,I sent your customer service team. Tell me if you need the tracking number.
"hi i just booked a flight but need to add baggage, how can i do this?","I booked a flight but I need to add luggage, how can I do that?"
"or watch some of the best student films in the country at 35,000 feet!","or watch some of the country's best student films at 35,000 feet!"
first time flying you all. do you have a different rate/policy for media bags? thanks,"First time, I'll steal you all. Do you have a different rate/policy for media bags? Thank you."
what happened to doom?!,What happened to death?
can't bring up my reservation online using flight booking problems code,cannot bring my booking online using the flight booking problem code
random q: what's the distribution of elevate avatars? i bet that kitty has a disproportionate share,random q: what is the distribution of high avatars? I bet the kitten has a disproportionate share
i &lt;3 flying va but life happens and i am trying to my trip jperhi can you help.va home page will not let me ?,i &lt;3 flight goes but life arrives and I try my trip jperhi can help you. Is this the homepage not gonna let me do it?
"""you down with rnp?"" ""yeah you know me!""","""you're with rnp?"" ""you know me!"""
"hi, i did not get points on my elevate account for my most recent flight, how do i add the flight and points to my account?","Hi, I didn't get any points on my last flight account, how do I add the flight and points to my account?"
why is flight 345 redirected?,Why is flight 345 redirected?
trying to add my boy prince to my ressie. sf this thursday from lax,I'm trying to add my prince to my ressie. sf this Thursday of lax
check out new music,see the new music
i was scheduled for sfo 2 dal flight 714 today. changed to 24th due weather. looks like flight still on?,I was scheduled for sfo 2 dal flight 714 today. changed in 24th time. Does it look like the flight is still in progress?
"has getaway deals through may, from $59 one-way. lots of cool cities",has escape transactions from $59 go simple. a lot of cool cities
"has getaway deals through may, from $59 one-way. lots of cool cities",has escape transactions from $59 go simple. a lot of cool cities
"do you provide complimentary upgrades to first class, if there are available seats?","provide additional improvements to the first class, if there are seats available?"
how can i watch the on my jfk-&gt;sfo flight?,How can I look at my Jfk-authorized flight?
is flight 882 cancelled flightled and what do i do if it is?,882 cancelled and what if it is?
has flight number 276 from sfo to cabo san lucas arrived yet?,Is it the flight number 276 of sfo to cabo san lucas?
dropped a track on you...,I left a lead on you.
can you find us a flt out of lax that is sooner than midnight on monday? that would be great customer service _ua,Can you find us a laxic flt that's earlier than midnight on Monday? would be a great customer service _ua
is there special assistance if i travel alone w/2 kids and 1 infant? priority boarding?,Is there any special assistance if I travel alone with children and an infant? Priority boarding?
is your website ever coming back online?,Is your site already online?
"- is flight 713 from love field to sfo definitely cancelled flightled for monday, february 23?","- is Flight 713 of the love field permanently cancelled in flight for Monday, February 23?"
is flight 0769 out of lga to dfw on time?,flight 0769 from lga on time?
my drivers license is expired by a little over a month. can i fly friday morning using my expired license?,My driver's license expired a little over a month. Can I fly Friday morning using my expired permit?
plans to include austin to its dallas route - topnews arab,dallas to its dallas route - topnews arab
to jump into the dallas-austin market -,to jump on the Dallas-Austin market -
"beats eps views, takes on va luv - investor's business daily","beats eps views, takes on va luv - the affairs of the daily investor"
lister to my show my on monday 1230 130,show on Monday 1230 130
to begin dallas-austin in april - 88.9 ketr,start dallas-austin in April - 88.9 ketr
i'd love to know what your policy is for damaged luggage.,I'd like to know what your policy is for damaged baggage.
i dm you,I love you
can you please have flights in sjc ? i have no choice but to fly southwest to vegas _u_u_,Can you please have flights in please? I have no other choice but to fly southwest to vegas u_u
if only you guys had flights from cmh.,If you had a centimeter flight.
having an issue finding a missing item on a plane. can you help me find which airport my plane headed to next?,having a problem finding a missing object in a plane. Can you help me find the airport where my plane went next?
ui@virginamerica:you've met your match.got status on another airline? upgrade : ? _uaa,ui@virginamerica: you met your game. another airline? upgrade : ?uaa
nervous about my flight from dc to lax getting cancelled flightled tomorrow! just sent you a dm to help me!,nervous about my flight of lax dc that canceled tomorrow! I sent you a doctor to help me!
can you please get me to the new york area before monday afternoon,Can you take me to the new york area before Monday afternoon
"on ipad and iphone, clicking the checkin link in the email i received at 24hrs before flight","on ipad and iphone, by clicking on the registration link in the email I received at 24 hours before the flight"
"ituas just a bug report, guys","It's just a bug report, guys."
any updates on flight 413 from jfk &gt; lax,all updates on jfk flight 413 &gt; lax
spruce moose!,moose!
"if you'd love to see more girls be inspired to become pilots, rt our free woaw event march 2-8 at abq.","if you would like to see more girls inspired to become pilots, rt our free event of the lady 2-8 March in abq."
"beats expectations, shares take off - santa cruz sentinel","beats expectations, actions take off - santa cruz sentinel"
any plans to start flying direct from dal to las?,plans to start stealing directly from the las dal?
big love/gratitude.mpower w/ werin vipswagbags@,great love/gratitude. mpower w/ werin vipswagbags@
grand budapest hotel,Grand hotel
this is what you missed next trip to the 407.,That's what you missed the next trip to 407.
shares rise on q4 financial results - usa today,shares increase on the financial results q4 - usa today
adds pillows instead of lie-flat seats in first class arms race,adds pillows to the place of flat seats in the first class arms race
way to take advantage of,medium to enjoy
you know i'm flying virgin for the fight,You know I'm stealing a virgin for battle
shares up on 4q results -,actions on 4q results -
_uo_uoiouiou_uon when are you guys going to start flying to paris? you're welcome.u,uo_uoiouiou_uon when are you going to start flying to bets?
what is your policy on flying after surgery? i am still waiting for answer so i can tell me doctor.,What is your flight policy after surgery? I'm still waiting for the answer so I can tell me doctor.
i think i left something on the plane yesterday. who do i call...ah!,I think I left something on the plane yesterday. who I call.
i need you to follow back in order to dm.,I need you to sweat to stop me.
need to start flying to . _u__uu_ua_ua,need to start flying at . u_uu_ua_ua
they told to check with the airline regulation first so that is why i contacted you.,"They said to check with airlines regulations first, which is why I contacted you."
what is your policy on flying after surgery?,What is your flight policy after surgery?
posts second consecutive full-year net profit -,second consecutive year posts -
results handily exceed forecasts -,results easily exceed the forecast -
"i applied for a position in ,and i was wondering if you guys received my application.","I asked for a job at , and I was wondering if you received my request."
achieves a second year of profitability despite revenue pressure ... -,reaches a second year of profitability despite the pressure of income ... -
"gives positive outlook, but sees increased competition -","gives positive perspectives, but sees increased competition -"
weather delays &gt; next few weeks,delays &gt; weeks to come
check the website before you go to the airport!,check the site before going to the airport!
pilot says we expect a choppy landing in nyc due to some gusty winds w/a temperature of about 5 degrees &amp; w/the windchill -8,pilot says we are waiting for a landing in nyc due to some inflated winds with a temperature of about 5 degrees &amp; w/ the ventile -8
is saving my sanity right now:,save my sanity right now:
missed my flight. how does standby work?,I missed my flight. How does it work?
brought it all the way across the country today i see,I've made all this way across the country today
are you ready!? let's say it together.. 'noooo turbulence today!' _u,Are you ready? Let's say it together. 'noooo turbulence today' _u
can u help this _uou needs urgent treatment in_ua14_uau2y old battling cancer could u help with flights _uon#freyasfund,can u help this _uou needs urgent treatment in_ua14_uau2y old cancer fight could help with flights _uon#freyasfund
may start service to hawaii from this year,can start the service from this year
add dtw and i'm sold!,Add it and I'm sold!
momma i made it! _u_u_u,"Mom, I did it! u_u_u"
please contact me about portfolio left on flight vx 27 from jfk to sfo tonite seat 7am. need it returned. call 914-329-0185.,Please contact me about the portfolio left on the flight vx 27 from jfk to sfo tonite seat 7am. I need him back. Call 914-329-0185.
help. i was on flight 27 from jkf tonight. seat 7c left portfolio. need it back!!,Help. I was flying jkf tonight. seat 7c left wallet. We have to get it back!
seattle bound. wifey got me the duffle for vday. she's a keeper!!! holla!!!,A bottle of sea. The woman took me the dick for vday. She's a guard! Holla!
debbie baldwin gave a performance of the safety demo this evening on vx919,debbie baldwin gave a performance of security demo tonight on vx919
many thanks for the follow. looking for any help_u _uon_uaa_ua_uon_ua14_uau_uon _u_u_ui_u_u,Thank you so much for the rest. search for any help_u uon_uaa_ua_uon_ua14_uau_uon u_u_u_u_u_u_u_u_u
"nice, lofty view",beautiful view loft
is my new go to airline,This is my new departure for the airline
can you help in need of some help in _u_u_uaa_ua_u_u_ua14_uau_u_u,can you help in the need of any help in u_u_uaa_u_u_ua14_uau_u_u_u_u_u
flight booking problems flight to uphold my status match. do taxes on ticket count as earned status points?,flight flight flight booking problems to maintain my match status. taxes on the ticket account as status points earned?
to jump into the market,to jump on the market
can you help? left my blazer in. kooples jacket bag at 3rd row second seat from right gate 36 t3 lax.. flight to sfo,Can you help? I left my blazer. Kooples jacket bag with 3rd row of second of right door 36 t3 lax. flight to sfo
partners with checkout as mobile payment method to help boost mobile conversion rates,partners with payment as a mobile payment method to help stimulate mobile conversion rates
i would like help with some flights please.,I'd like to help you with flights.
bruh ui@virginamerica: turn down for what.,bruh ui@virginamerica: drop for what.
digging the swanky pink mood lighting during the flight from nyc to sfo. just needs a cabaret singer. think about it!,dig the crispy pink mood lighting during the flight from nyc to sfo. You just need a cabaret singer. Think!
"done, but i need the receipt asap. could you please help?","It's done, but I need the cash. Can you help?"
adds pillows instead of lie-flat seats in first class arms race by,adds pillows to the place of flat seats in the first class arms race
"i just did, how can i dm? do u have to also add me?","I just did it, how can I get it? Do you have to add me?"
"anytime, sugafly.","At any time, sugafly."
i need a receipt for a flight change. can you send one?,I need a receipt for a flight change. Can you send one?
ceo says &amp; have strayed from low cost model.,ceo said &amp; have lost the model at low cost.
a brilliant brisk am in boston in cue for vx363,a shiny lamp with cue boston for vx363
atlantic ploughs a lone furrow in the,the atlantic carts a solitary forehead in
atlantic ploughs a lone furrow in the,the atlantic carts a solitary forehead in
atlantic ploughs a lone furrow in the,the atlantic carts a solitary forehead in
when are you flying to hawaii,when fly to hawaii
.@virginamerica if only you guys were starting those flights at the end of the month! guess iuam still road tripping on feb 27u_,@.virginamerica if only you started these flights at the end of the month! guess iuam always travels on road on feb 27u_
announced new route to austin w/fares from $39/way.,announced a new route for austin w/fares from $39/way.
really? sprint? i thought you guys were 'kewl'! 0_0,Really? I thought you were kewl! 0
you should have 39 dollar lax-las fares!!!,You should have $39 lax-las!
you should still develop an app - then you will be my favorite airline.,you should still develop an application - then you will be my favorite airline.
no a's channel this year?,No channel this year?
only thing i see on passbook is virgin mobile mexico. how do i integrate?,The only thing I see on the passbook is the virgin mobile mexico. How can I integrate?
is helping me step up my game!,Help me play my game!
announces new nonstop connecting &amp; $39 intro:,announces new non-stop connection and $39 intro:
adds austin-dallas love field route.,add austin-dallas route love field.
"- can you tweet me the cancelled flight/chng fee for a flight? or can i rebook under one of your affiliates? if so, who are afiliates?","- Can you tweet me the cancelled flight charges for a flight? or can I rebook under one of your subsidiaries? If so, who is afiltered?"
"now, when will we see virginamerica come to philadelphia (phl).","Now, when will we see virginamerica coming to philadelphia (phl.)"
to start 5xweekly flights from to on 28apr,to start 5 weekly flights from to 28apr
nice to see you expanding in texas but don't forget about us here in i would love to see more flights out of here!,nice to see you spread in texas but don't forget about us here in I would love to see more flights out of here!
to battle on route via,to fight on the road via
i miss the in san jose,I missed the san jose
can we make every vx plane with why should austin be the only one getting nerd love?,Can we do all the planes with why austin should be the only one to have a neat love?
please add more frequency to pdx portland,please add more frequency to pdx portland
can u help with flights to get a 2y old battling cancer who needs treatment in _ua14_uau _uon _u_u _uon,can help you with flights to get 2-year cancer that needs treatment in ua14_uau _uon u_uon
does virgin america fly direct from seattle to nyc or boston?,Does the virgin america fly directly from water to nyc or boston?
save some for 871 tomorrow am!,Keep it for 871 in the morning!
club virgin is bumping in new york,virgin club is sprinkled with new york
is that,It's just
...please come to minneapolis st. paul!,. Please come to minneapolis st. paul!
yes fyi my bff,"Yeah, I got my bff."
do you have an application for ios? was looking and only saw virgin mexico &lt;/3,Do you have an application for ios? was looking for and only seen virgin mexico &lt;/3
good point!,Good point!
.@virginamerica i heard he has a virgin mobile hotspot,@.virginamerica I heard he had a virgin mobile hotpot
you got cheese plate flights too.,You also have cheese flights.
on all your flights?,on all your flights?
how come abc is the only one of the network channels you don't have?,how to come abc is the only network channel you don't have?
"dear virgin customer, while you're stranded in sf for 3 days &amp; $1000cost- we'll do the very least we can to accommodate you!","Dear virgin client, while you are stuck in sf for 3 days and $1,000- we will do the least we can to welcome you!"
should use this in their next airline commercial lol ::,should use it in their next commercial air lol ::
any way to change from main cabin to main cabin select (on same flight) without paying a change fee penalty?,any way from the main cabin to the main cabin select (on the same flight) without paying a change fee penalty?
can you give me silver status for 12 months?,Can you give me the money status for 12 months?
are there any sign up bonuses to enroll in elevate?,Are there any bonuses to register to raise it?
morning. if i have a question regarding elevate points &amp; flights can i dm you?,Hello. If I have a question about high points and flights can I be dm?
still waiting to see _u_,waiting to see u
was wondering if you guys recieved my dm and we're able to potentially respond asap,I was wondering if you have recieged my dm and we are able to answer an asap
ui@virginamerica: book out of town with fares from $59/way (+restr).,ui@virginamerica: book out of town with rates from $59/way +(restr.)
even on international flight glasgow to the u.s.? then what about orlando to newark? all 90 mins?,Even on the international flight glasgow to u.s? and the orlando to newark? 90 minutes?
"i understand, but it's tough when there is no way to get to the airport w/o serious risk of an accident. it's a steep price.","I understand, but it's hard when there's no way to get to the airport with a serious accident risk. It's an abrupt price."
flying gla-mco in a few weeks. how long do we have to be at airport for before departure for both international and domestic? ta,stealing ice-mco in a few weeks. How long should we be at the airport before departure for international and national countries? ta ta ta ta ta ta ta ta ta ta ta ta ta ta ta ta ta ta ta ta ta ta ta ta ta ta ta ta ta ta ta ta ta ta ta ta ta ta ta ta ta ta ta ta ta ta ta ta ta ta ta ta ta ta ta ta ta ta ta ta ta ta ta ta ta ta ta ta ta ta ta ta ta ta ta ta ta ta ta ta ta ta ta ta ta ta ta ta ta ta ta ta ta ta ta ta ta ta ta ta ta ta ta ta ta ta ta ta ta ta ta ta ta ta ta ta ta ta ta ta ta ta ta ta ta ta ta ta ta ta ta ta ta ta ta ta ta ta ta ta ta ta ta ta ta ta ta ta ta ta ta ta ta ta ta ta ta ta ta ta ta ta ta ta ta ta ta ta ta ta ta ta ta ta ta ta ta ta ta ta ta ta ta ta ta ta ta ta ta ta ta ta ta ta ta ta ta ta ta ta ta ta ta ta ta ta ta ta ta ta ta ta ta ta ta ta ta ta ta ta ta ta ta ta ta ta ta ta ta ta ta ta ta ta ta ta ta ta ta ta ta ta ta ta ta ta ta ta ta ta
why not? is it a law or a policy?,Why not? Is it a law or policy?
"no i don't, but i'm sure united have my info on its system.","No, but I'm sure we have my information on his system."
just submitted my response on the link you sent.,just submitted my answer on the link you sent.
"yes, david allan send an email with this number (kmm24999563v99860l0km) and case#8719519","yes, david allan send an email with this number (kmm24999563v99860l0km) and case#8719519"
"yes, a paper voucher that i got on january 26th 2015","Yes, a good paper I received on January 26, 2015"
"do i need to use a chase united club pass for my 8yr old son, or can he come in with me on my pass?","Should I use a hunting club for my 8-year-old son, or can he come with me on my way?"
and what am i suppose to do with that number?,And what do I have to do with this number?
i lost a voucher that i was given in miami aeroport on jan 26. i did not use it.,I lost a good I received at miami aeroport on Jan 26. I didn't use it.
gee that's like almost caring about ppl more than $$. think i'm more int in having a trusted adult w/ daughter .,It's like taking care of almost ppl over $. I think I'm more int with a reliable adult with a girl.
that's right- with an overnight miami.,That's right. with a night mum.
have clients with an 11 hr layover at iah (during the day). will they have to claim &amp; recheck luggage. or will it be taken care of?,having customers with an 11-hour rest at iah (during the day.) will have to ask and rever the baggage. or will it be taken care of?
"i am trying to find out if the loaner seat is new or used, a used car seat is illegal according to safety regulations","I'm trying to find out if the lender's seat is new or used, a used car seat is illegal according to security rules"
i dmed you the details,I put the details on you.
"kewl. will also let them know the overhead bin over my row was ""inop"". i love a good abbreve.",kewl. I'll also tell them that the trash on my line was inop. I love a good abbreve.
thanks again for your concern. i will contact customer care upon our return from australia.,Thank you again for your concern. I'll contact the customers when we get back from Australia.
6533 ord to dca,6533 ord to dca
"cancelled flighted our flight, didn't rebook us on added flight, now have to drive from a denver to kc....thanks!","canceled our flight, we didn't rebook on the added flight, now we have to drive from a denver to kc. thanks!"
your announcement for pre boarding only addresses mobility. my disability requires me to travel with a lot of stuff. do i preboard?,your ad for pre boarding only addresses mobility. My disability makes me travel with a lot of things. - I'm prevising?
the os isn't controlled by me but rather . app is new.,The bone is not controlled by me but rather. the application is new.
it was last night's 1235/ord-lga.,It was 1235/oud-lga last night.
thank you !,Thank you!
dm these nuts,dm these nuts
thanks for the info i already knew...,Thank you for the information I already knew.
airline trouble this winter &amp; not getting good customer service? contact we negotiate resolutions for you!,the airline troubled this winter and not get a good customer service? contact us negotiate resolutions for you!
thank you.,Thank you.
is there an email address i can reach? too long for a dm.,Is there an e-mail address I can reach? too long for a m.
so do i need to book two one ways in order for her to fly as an unaccompanied minor?,So I need to book two ways to fly as an unaccompanied minor?
pls help baby hannah get the life saving surgeries she requires.she needs your help.pls donate/rt,ps help hannah baby to get the rescue surgery she requires. She needs your help. donate/rt
"bet you wont honour them, like mine ey","You won't honor them, like mine."
"i guess that's too much ask, huh?","I guess it's too much to ask, huh?"
please be good to me this weekend!,Be nice to me this weekend!
a tourist wonder: super tides and tide of the century at french and u.k coasts:,a tourist wonder: super tides and tides of the century to the French coasts and u.k:
yall should probably work on that.,yall should probably work on it.
yes please! trying to get to pop- in newark now....,"Yes, please! I'm trying to get to newark."
