0,1
"while iuam askingu_ 2 of my 11 non upgraded flights, attendants came &amp; greeted me &amp; thanked me for my business b/c i was exec plat.","while iuam asku_ 2 of my 11 unimproved flights, the attendants came &amp; welcomed me &amp; thanked me for my company b/c i was exec plat."
but question : if the downgrade include losing first class do you get money back ?,"but question: if the subclass includes losing the first class, you get money?"
i am good. i just did not understand the terminology. but the merger brings new verbiage,I'm good. I didn't understand the terminology. but the fusion brings a new verbiage
can you priv chat to help chairman reroute,can you private cat to help president reroute
new marketing song? let us know what you think?,new marketing song? Tell us what you think?
can you help chairman? i am on flight 686 phx connect 599 sjc will miss connection can you reroute please.,Can you help the president? I'm on flight 686 phx connect 599 sjc will miss connection can reroute you please.
"also, can you explain why, when i checked in, on the us airways site, &amp; picked ""standby for 1st"" i was not put on the list?","Can you also explain why, when I checked, on the airway site, and chose ""standby for 1st"" I was not put on the list?"
is it your practice to give 1st class seats to us air employees before giving them to chairmans customers sitting in coach?,Is it your practice to give first-class seats to our air employees before giving them to the customer chairs sitting as a coach?
direct flights to sfo leaving from same airport with and - can you please put me on one of those?,direct flights from the same airport with and - can you put one?
how does one downgrade a flight?,How does one lower a flight?
i'm shutting my data off for the flight. i want some response by the time i land. you have 2 hours.,I'm closing my flight data. I want an answer when I land. You have two hours.
and i would have been willing to give him the benefit of the doubt and say we misunderstood each other until he went on a,and I would have been willing to give him the benefit of doubt and say that we misunderstood until he went
doesn't take into account the $450 it cost 2 rent a car 2 drive home,does not take into account the $450 that it cost 2 rent a car 2 drive home
"am i allowed to carry on a suit bag and carry on bag? my suit bag will hang like a jacket would. it is soft sided, 48""","I'm allowed to carry a bag and carry a bag? My suit bag will be suspended like a jacket. It's soft, 48"""
so it's a $25.00 bag fee for a golf bag on a domestic flight?,So this is a $25 bag for a golf bag on a domestic flight?
"hi guys, do you have a general enquires email address please? thanks david.",Do you have a general email address? Thank you.
following you now,I'm following you now.
sorry i didn't realize i wasn't following you,I'm sorry I didn't realize I wasn't following you.
"is there an additional charge for a golf bag with clubs , shoes, and golf balls, if that's the only piece of luggage you check?","Is there a supplement for a golf bag with clubs, shoes and golf balls, if this is the only baggage you check?"
"if i apply for ur credit card, do you automatically get the companion certificate or do i have to wait for it?","If I ask for an ur credit card, you automatically get the companion certificate or I have to wait for it?"
"it's 838. we boarded and we are waiting now to take off, hopefully.","838. We have boarded and we are now waiting to take off, hopefully."
"us 728. refuel; we've sat for so long. pilot announces where the truck is. ""look, over there to the left!"" actual announcement.","We 728. We've been sitting for so long. The pilot announces where the truck is. ""Look to the left!"""
trying to chg ticket for staff member leaving org before she can fly.we're a nonprofit-can't you make an exception?,"trying to fire the ticket to the grievor leaving the bar before she can fly. We're not for profit, can't you make an exception?"
"us 728 wait, now a gate opened. back we go. (good, maybe we can get off.)","We 728 are waiting, now an open door. Let's go. (good, maybe we can go.)"
us 728 stated their issues as: kept plane on ground to allow connecting passengers from other flight to board. fine. understand.,"we 728 stated their problems as: maintaining the aircraft on the ground to allow connecting the passengers of another flight on board. All right, all right."
trying to book award travel leaving on red-eye sunday night after midnight. should i book the date in sunday or monday?,trying to book a price trip on the red eyes Sunday night after midnight. Should I book the date on Sunday or Monday?
bag policy says stroller or car seat. we need to bring 2 car seats and 1 stroller. should i just call for details?,the bag police said pushchair or car seat. We need to bring 2 car seats and 1 pushchair. Should I call for details?
"contact via fb messages, twitter dm or text?","contact via fb, twitter dm or text messages?"
"great operation you guys are running. more mechanical issues, and now taping piece of plane together lol","Great operation you run. more mechanical problems, and now tap a piece of plan together lol"
thanks! any idea when it will be resolved? i'd like to purchase my ticket!,Thank you! Any idea when she's resolved? I'd like to buy my ticket!
"hi, can you attach my aa ff# 94lxa62 to reservation e2kvm4. thansk!","Hello, can you attach my aa ff# 94lxa62 to the reservation e2kvm4. Knock!"
hi guys! are flights 5594 and 3937 still on time? the site and app are both down and i can't check. thanks!,"Hey, guys! Are flights 5594 and 3937 still on time? the site and application are both down and I can't check. Thank you!"
"yes, i made the flight and got my workout in too.","Yeah, I did the flight and I did my training too."
will you pick up your phone then?,Are you gonna get your phone?
"thank you, but it says the website is down","Thanks, but he says the site is down"
"i understand that, and when i'm attempting to change the information so they are identical, it tells me to call a","I get it, and when I try to change the information so that they're the same, it tells me to call one"
"taking off now. if i don't have a private jet to bora bora by the time i land, i'm calling oprah","Take off now. If I don't have a private jet in bora bora when I land, I call oprah"
i need to move a reservation due to weather in the middle part of the u.s. i would like to change departing airport,I need to move a booking due to the weather in the central part of the u.s I would like to change the airport from
can someone help me with some travel issues today?,Can anyone help me with travel problems today?
"there is nothing on my usair cc at this point, but the email stated i would be charged. thanks for the reply.","There's nothing on my cc usair at that time, but the email said I'd be loaded. Thank you for the answer."
&amp; what are your weight restrictions for carry on luggage? can find measurements but not weight restrictions. tia,What are your weight restrictions for the transport of baggage? can find measures but not weight restrictions. tia
4473. she just called to say it's a runway clearing problem of all things.,4473. She called to say that it's a problem with track debris.
will all flights out of dfw be cancelled flightled today?,all flights out of the dew will be cancelled today?
can you add my ktn to an existing reservation?,Can you add my ktn to an existing reservation?
i'm supposed to fly through dallas. can you help me get a new itinerary?,I'm supposed to be going through the dallas. Can you help me find a new route?
"i'm referring to email like this. just tell people when they get the upgrade. otherwise, we know already.",I'm talking about e-mail like that. Tell people when they upgrade. otherwise we already know.
"i just reserved a flight with my companion certificate, where do i mail the certificate for verification???? thx!!!","I just booked a flight with my companion certificate, where can I send the verification certificate? thx!"
"do your flight schedules to - from quintana roo, mexico reflect their newly adopted time zone change to est?","your flight schedules to - quintana roo, does the mexico reflect their change in the newly adopted time zone?"
: maybe you should drive,Maybe you should drive
thank you for the apology,Thank you for the apology
is your refund system down?,Is your refund system down?
"that's not the case.. they sent me a email with a link, i'll show you..","I don't. They sent me an email with a link, I'll show you."
"4469, thank you for asking.","4469, thank you for asking."
"any progress? good luck, patrick!","Progress? Good luck, patrick!"
and aren't as merged as the marketing departments would have us believe. maybe or can get me home?,and are not as merged as marketing services would have made us believe. Maybe or maybe take me home?
looking for some help to recover an item i left on an airplane this evening,Seek help getting an article I left on a plane tonight.
have you issued a memphis travel advisory for tomorrow? winter weather coming through now.,Have you issued a travel notice for tomorrow? winter time is now passing.
"can you help with a seat assignment? 5 people flight 694, phx to hnl, seats are split up. anything you can do will be great.","Can you help a headquarters assignment? 5 persons flight 694, phx at hnl, seats are separated. Everything you can do will be great."
follow/dm please,follow/dm please
flight 4424 operated by (n813ma) arrives at following flight from reagan national,Flight 4424 operated by (n813ma) is due to the flight from the national reagan
do you have an email??,Do you have an email?
what happens to frequent flyer miles earned once merger is complete with aa?,what happens to miles of frequent flyer won once the merger with aa is completed?
any idea when flight 703 to miami will leave for a second time?,Any idea when the 703-miami flight leaves for a second time?
"yea, they will give you 5 cents on the dollar!",They'll give you five cents on the dollar!
do you know what flight the pilots for 1581 are coming in on? thanks.,Do you know what the pilots' flight for 1581 is coming?
can you provide me with info about checking strollers and car seats? costs? restrictions? need to bring 2 seats 1 stroller.,Can you provide me with information on the inspection of pushchairs and car seats? the costs? 2 seats 1 pushchair.
i have received two reservation check-ins for two different flights for my one flight tomorrow morning. need assistance asap,I received two booking check-ins for two different flights for my only flight in the morning. need for assistance
cancelled flightled the last part of a ticket and am confused from the email i received whether value remains. is there someone i can ask?,canceled the last part of a ticket and I'm confused with the email I received if the value remains. Is there anyone I can ask?
please have your people hold flight 599 from phoenix to san jose. we pulling up to the gate! scheduled to depart at 5:40,Please take flight 599 of phoenix to san jose. We're going to the door! scheduled to leave at 5:40
"sorry, we are in philly. should've told you that.","Sorry, we're on philly. I should have told you."
pilot says that we are going to take off in 10 minutes. so maybe the systems came back online?,The pilot says we're gonna take off in 10 minutes. So maybe the systems came back online?
this is happening now.,It's happening now.
can i get a beer please. flight,"I can have a beer, please. flight"
what's going on in clt?,What's going on in clt?
so any ideas when the it geeks will plug in the servers so 639 can be on its way to phx?,So all the ideas when the geeks will plug the servers so that 639 can be on the way to the phx?
any update on the computer outtage affecting flights? is this national or just northeast? eta on resolution?,an update on the off-voltage computer affecting the flights? Is it national or just northeast? Was on resolution?
my wife left her phone on flight awe474 on friday february 20th upon landing in minneapolis. how can we get it back? thanks!,"my wife left her phone in awe474 flight on Friday, February 20th at minneapolis landing. How can we get it back? Thank you!"
glad people can put their coats in the storage area though. it would be super unfortunate to leave those on the floor,Happy people can put their coats in the storage area. it would be very unfortunate to leave people on the ground
but good luck getting there! not cool.,"But good luck getting there, not cool."
"i saw online you had fee but i was wondering if there was a way to pay for it ahead of time, instead of at the kiosk","I saw online that you had a fee, but I was wondering if there was a way to pay it before the hour, instead of the kiosk."
y'all need to get it together,You need to get together.
no i need the corporate office number please as that is who is dealing with this for me. it's a 480 number.,"I don't need the business office number, please, 'cause it's who's dealing with it for me. It's a number 480."
"if my flight, 4035, is delayed, what time do i have to arrive at bhm?","If my flight, 4035, is delayed, what time should I arrive at bhm?"
do you have bereavement discount on airfare as my grandfather just passed and need to attend his funeral this week.,Do you have discounts on the aerodrome that my grandfather has just passed and must attend his funeral this week.
mad love nyc-,crazy love
"when aa gate supervisor 600117 was asked for his superiors name, response received was ""the ceo of","when a door supervisor 600117 was requested for his superior name, the response received was ""the ceo of"
aa gate supervisor emplid 600117 allowed flight aa67 to leave jfk to sj on 20feb15 w/o 8 customers that made final boarding call.,aa portal supervisor emplid 600117 allowed the flight aa67 to leave jfk to sj on 20feb15 w/o 8 customers who made final boarding call.
you should update your passbook passes with any gate changes.,you must update your passbook passes with any change of door.
"got transf. to dividend miles...need to change flight. grandma just passed, need to change ticket asap. update on wait time?","was transferred to miles of dividends. to change the flight. Grandma just passed, we have to change the ticket. update the waiting time?"
just told by supervisor that they won't guarantee the empty seats to standby passengers with flights cancelled flightled so can sell them,just said by the supervisor that they will not guarantee empty seats to passengers on hold with cancelled flights in flight to sell them
what's the contact number for the corporate baggage office in phoenix?,What is the contact number for the company's luggage office at phoenix?
with this livery back in the day.,with this delivery in the day.
look into better service.,Look in a better service.
flights to dfw cancelled flightled today?,flights to dfw cancelled in flight today?
what's your pet policy?,What is your pet policy?
come scoop,Come here
i used my aadvantage number connected to the usairways when i booked tickets for friends. will it benefit my account?,I used my advantage number connected to the usairways when I booked tickets for friends. Will it benefit my account?
my hubby has a 5hr layover in dfw fm the cxl'd flt. pls help get him home sooner if you can! any room on s/by 2 bwi or phl today?,my hubby's got a five-hour delay in the dfw fm the cxl'd flt. ps helps bring him home earlier if you can! any room on s/by 2 bwi or phl today?
am 2. 1/2 hours from airport sure would like to talk to someone,2. 1/2 hours from the airport certainly would like to talk to someone
with chocolate flight please... i m melting,"with a chocolate flight, please. i m fond"
sadly they've tried that and airport agentsu_no flights so they're stranded at phl. no chance of a hotel for them?,"Unfortunately, they tried this and the airport agentsu_no flights so they're blocked to phl. Any chance of a hotel for them?"
with a glass of wine once we hit altitude?,with a glass of wine once we reached the altitude?
i want an icecream baby...,I want an ice cream baby.
i ve been told that you get a percentage on every plastic bottle that is sold around yout departure section...turn up the heat,I was told that you get a percentage on each plastic bottle that is sold around the starting section of the plate.
at least they make you run so you want yo buy this fresh diet coke...nice bizness plan. its all about marketing right?,At least they make you run so you want yo to buy this coke of fresh diet. Bizness plan. its all on the right to marketing?
any help regarding flights out of kphl would be much appreciated,any help with flights out of kphl would be very appreciated
but need to confirm please help,but need to confirm please help
one question. can i book one way tickets with award travel/points,a question. can I book tickets in a way with points/travels
"if i rebook on another airline after my flight was cancelled flightled, do you reimburse? i need to get home today, not tuesday.","If I book on another airline after the cancellation of my flight, you pay off? I have to go home today, not Tuesday."
how do i reserve my seat on the aa flight i transfer to from ord to evv?,how to reserve my seat on the flight has that I transfer from ord to evoke?
8am flight to mco canld &amp; resch 1:30.if we opt for 8 am depart tom will us air allow cng return day from sat to sun w/o penalty?,flight from 8h to mco canld &amp; resch 1:30. if we opt for 8 am from part tom we will allow the air to allow the return day of cng of sat to sun w/o penalty?
flying from orlando to philly to charlotte to lynchburg. saw advisory re philly. wld like to fly from orl to char,stealing from orlando to philly to the cart at lynchburg. saw the philly board. wld like to fly from orl to char
i think it's ok.,I think it's okay.
"just had to buy a ""safety"" ticket online. you'll refund whichever ticket(s) are unused, in full, without penalty.","You just had to buy a security ticket online. you will refund all unused tickets, in whole, without penalty."
download jeokoo the american app for air travelers,download jeokoo the American application for air travellers
"i intend to..very much. my 4,000 followers will as well.","I intend to. a lot. My 4,000 followers, too."
in a few weeks,in a few weeks
yes - tells me the only way to mod plans is to call the 4322 number.,Yes - tells me the only way of mod plans is to call number 4322.
can i book award travel on etihad with dividend miles?,Can I book a trip on etihad with miles of dividend?
what's going on with passengers diverted to clt on fll to phl flight that left at 830 tonight?,What's going on with the detoured passengers to fly at 8:30 a.m. tonight?
- my guess is what happened in ended up in,- I guess that's what happened.
can i get an update on flight 680 to dca?,Can I get an update on Flight 680 at dca?
don't want to clog your already-crowded line with a special meal request. can someone dm me to sort out?,do not want to pack your line already cast with a special meal request. Can anyone fix me?
i should also add the weather conditions are terrible. expecting 18 inches of snow. any advice?,I should also add the weather conditions are terrible. waiting for 18 inches of snow. advice?
i'm on flight 623 from dia to ontario tomorrow morning. no access to the airport via taxi or shuttle. what should i do?,I'm on 623 in a slide flight to ontario tomorrow morning. no access to the airport by taxi or shuttle. What should I do?
"well, depending on the policy will make the determination as to which airline is selected to travel.","Well, according to the policy, the chosen airline will be determined to travel."
just landed flight 545. any chance of making flight 5530 phoenix to aus,Flight 545. any chance to fly 5530 phoenix aus
how long before departure do gates stay open? will i make my connecting flight 1861 to rdu from flight 894???,How long before the departure the doors remain open? I'll do my 1861 correspondence flight from Flight 894?
i'm flying with you this summer. will i be able to leave miami airport during my 12 hour stopover there?,I'm flying with you this summer. Can I leave the miami airport during my 12-hour stop?
message me if you want to issue a refund so someone else can use my seats tomorrow am flighted,Send me a message if you want to make a refund so someone else can use my seats tomorrow.
..off to vegas,.off to vegas
hello we are doing a world record attempt on the amount of ball point pens in a collection please could you help with a pen?,Hello we make a world record attempt on the quantity of ballpoint pens in a collection please could you help with a pen?
"if i am traveling with an infant in my lap, is there anything i need to do to notify you?","If I travel with a baby in my turn, is there something I have to do to warn you?"
can you help us figure out our correct six digit confirmation number?,Can you help us find our six-digit confirmation number?
what about aa miles for usair flights booked through american?,What if we had miles for usb flights?
can you dm me please?,Can you excuse me?
need seat assignments for one leg of family's return flight - can you please help via twitter pm?,need seat assignment for a family return flight leg - can you help by twitter pm?
okee doke,Dokee
this very pregnant lady's hoping &amp;praying hubbys flight from bwi gets off the ground! i'd like him to get here before baby does!,this very expectant lady and bwi flight spy comes out of the ground! I'd like it to happen before baby does it!
ok thanks,Okay.
"can't control weather/flight attendant.can control this-green acu bag, 1.5 hrs &amp; counting! yep that's me!","cannot control the weather/supply conditions. can control this green acu bag, 1.5 hrs &amp; counting! It's me!"
how does flight 680 look? i'm hearing about cancelled flightled departures from and i'm about to head into it,How does Flight 680 look like? I've heard about the cancelled departures and I'm about to go.
what is contact info to upgrade using advantage miles?,what are the contact information to upgrade using miles advantage?
what about upgrades?,and upgrades?
how do you have only 1 flight into lexington this afternoon with the playing a big game tonight?,How do you only have a flight to lexington this afternoon with the game of a big game tonight?
flight 1815 (n747uw) arrives at following flight from,flight 1815 (n747uw) arrives from the following flight
- what is your policy regarding large-size passengers who cannot fit into a single coach class seat?,- what is your policy regarding large-sized passengers who cannot enter a single coach class seat?
does anyone know the hold times for usairways reservations?,Does anyone know the retention times for usairways bookings?
"what's the point of email stating i didn't get bumped to 1st class? i know i'm not in first class, i booked the regular ticket","What is the email point that I wasn't hit in the first class? I know I'm not in the first class, I booked the regular ticket."
"we're glad to hear it. out of curiosity, what causes such flight patterns?","We are happy to hear it. Out of curiosity, which causes such flight patterns?"
so no idea? thanks...,Any idea? Thank you.
international,International
"landed at phoenix, but we had to board a flight quickly to vegas so no time at the airport. what now?","landed at phoenix, but we had to take a flight quickly to go to the gas, so no time at the airport. And now?"
i left something on a recent flight today. who do i contact to retrieve it please? thanks!,"I left something on a recent flight today. Who am I contacting to get it back, please? Thank you!"
"you need to check information regarding hotels, shuttles, re routing flights, delayed flights","you need to check information about hotels, shuttles, routing flights, delayed flights"
"ah, and i was only given one shuttle voucher, so if i do ever get back to the airport you'll be getting the bill","ah, and I only got one shuttle coupon, so if I come back to the airport, you'll get the bill."
no worries i was able to read entire book while holding.,I didn't have any trouble reading the whole book by holding it.
can you help me add a aadvantage number and known traveler number to a reservation?,Can you help me add an advantage number and a travel number known to a booking?
i have corporate-paid travel in april. is it possible to purchase an upgrade to first class now?,I have a trip paid by the company in April. Is it possible to buy a upgrade to the first class now?
that's who i spoke to already. we've already booked another flight w/someone else. thanks for your concern. just wanted to,That's who I've spoken to. We already booked another flight with someone else. Thank you for your concern. I just wanted
are u paying incedentals?,Are you paying incedentals?
is a bag that is 23ul x 9uw x 12uh allowed as a carry on?,is a bag that is 23ul x 9uw x 12uh allowed as a carrier?
there is nothing tonight and i am on the flight now with gogo internet is there a way that someone could send me a dm or email?,there's nothing tonight and I'm on the flight now with internet gogo is there a way someone could send me a dm or an email?
"it's a debit card, but i am a dividend member.","It's a debit card, but I'm a dividend member."
how do i redeem my pass to the admirals club? i have 1 free visit with my barclay card membership. and can i bring a companion?,How can I redeem myself at the Admiralist Club? I have 1 free visit with my barclay card subscription. And can I bring a companion?
almost home ...east coast freeze headed to phl connect avp tgif,Almost the house. coast is gel heading towards phl connect avp tgif
