0,1
plus you've added commercials to the experience... tacky.,the more you added advertisements to the experience. tacky.
"yes, nearly every time i fly vx this uiear wormu wonuat go away","Yes, almost every time I fly vx this uiear veru wonuat go"
"well, i didn'tu_but now i do!","Well, I didn't, but now I'm doing it!"
"it was amazing, and arrived an hour early. you're too good to me.","It was amazing, and it happened an hour early. You're too good for me."
i &lt;3 pretty graphics. so much better than minimal iconography.,i &lt;3 pretty graphics. so much better than minimal iconography.
this is such a great deal! already thinking about my 2nd trip to &amp; i haven't even gone on my 1st trip yet! ;p,It's so awesome! already thinking about my second trip to &amp; I haven't even made my first trip yet! ;p
i'm flying your skies again! u take all the away from travel,I'm again stealing your heavens! u take all travel distances
thanks!,Thank you!
so excited for my first cross country flight lax to mco i've heard nothing but great things about virgin america.,so excited about my first cross country to mco flight lax that I only heard great things about virgin america.
i _u flying 14u_uo,i _u flying 14u_uo
you know what would be amazingly awesome? bos-fll please!!!!!!! i want to fly with only you.,You know what would be incredibly awesome? Please! I want to fly with you.
i love this graphic.,I love this chart.
i love the hipster innovation. you are a feel good brand.,I love hipster innovation. You're a luxury brand.
this is great news! america could start flights to hawaii by end of year via,That's good news! america may start flights to hawaii by the end of the year via
moodlighting is the only way to fly! best experience ever! cool and calming. _uoiio,pleasure is the only way to fly! best experience ever! cool and quiet. _uoiio
"done and done! best airline around, hands down!","done and done! The best airline, hands down!"
"view of downtown los angeles, the hollywood sign, and beyond that rain in the mountains!","view of the city center of los angeles, the clear wood panel, and beyond this rain in the mountains!"
i'm for a good reason: you rock!!,I'm for a good reason: rock!
wow this just blew my mind,I just blew my mind
julie andrews all the way though was very impressive! no to,"julie and andrews all the way, but was very impressive! No."
you know it. need it on my spotify stat,You know that. I need that on my stat.
i'm lady gaga!!! she is amazing! _u_,I'm Lady gaga! She's amazing! u
love all three but you really can't beat the classics!,love the three but you can really not beat the classics!
congrats on winning the award for best deals from an airline (us),Congratulations on winning the award for the best offers of an airline (us)
"not worried, it's been a great ride in a new plane with great crew. all airlines should be like this.","It's not worried, it's a great ride on a new plane with a big team. All airlines should be like that."
awesome. i flew yall sat morning. any way we can correct my bill ?,Great. I stole in the morning. any way we can fix my bill?
i've applied more then once to be a member of the crew team...im 100% interested. -g,I once again asked to be a member of the crew. 100% interested. - g
"- amazing customer service, again! _uo_uo raeann in sf - she's the best!",- an incredible customer service again! uo_uo raeann in sf - it's the best!
"has getaway deals through may, from $59 one-way. lots of cool cities",has escape transactions from $59 go simple. a lot of cool cities
"has getaway deals through may, from $59 one-way. lots of cool cities",has escape transactions from $59 go simple. a lot of cool cities
have a great week _ui_io,have a good week ui_io
come back to already. we need you to take us out of this horrible cold.,Come back already. We need you to take us away from this horrible cold.
"is the best airline i have flown on.easy to change your reservation,helpful representatives &amp; a comfortable flying experience","That's the best airline I stole. easy to change your booking, helpful representatives and a comfortable flight experience"
and again! another rep kicked butt! naelah represents your team so beautifully!! thank you!!!,And again! Another one kicks his ass! naelah represents your team so beautiful! Thank you!
your beautiful front-end design is down right now; but it was cool to still book my ticket b/c all your back-end was secure.,your beautiful front design is down now; but it was cool to book my b/c ticket all your back-end was secure.
"love the team running gate e9 at las tonight. waited for a delayed flight, and they kept things entertaining","Loves the team that runs the e9 door at las tonight. waiting for a delayed flight, and they kept things entertaining"
thanks to your outstanding nyc-jfk crew who moved mountains to get me home to san francisco tonight!,thanks to your nyc-jfk team who moved mountains to bring me back to the san francisco house tonight!
you have the absolute best team and customer service ever. every time i fly with you i'm delighted. thank you!,You have the best team and customer service ever. Every time I fly with you I'm happy. Thank you!
completely awesome experience last month bos-las nonstop. thanks for such an awesome flight and depart time.,experience completely awesome last month bos-las non-stop. Thank you for such an impressive flight and leave.
you rock for making it so i can watch on my flight!!,You're making fun of this so I can watch my flight!
always!!! xoxo,Always! xoxo
best customer service rep in the world! takes the cake!!!,best customer service in the world! Take the cake!
you have amazing staff &amp; super helpful as i just ran the they have spoiled me with comfort!!!,You have an incredible and super helpful staff because I just ran the they spoiled me with comfort!
always have it together!!! you're welcome! rt you're so welcome.,Always have it together! You're welcome.
home to in' back to,go home
thank you for checking in. tickets are purchased and customer is happy,Thanks for checking. tickets are purchased and the customer is happy
thank you for the follow,thanks for the follow-up
_u_ rt youuave met your match. got status on another airline? upgrade (+restr):,u rt youuave met your game. Another plane? upgrade +(restr:)
only way to fly!,Just a way to fly!
you will match my status? cool!,Are you going to match my status? cool!
thanks!,Thank you!
i love your guy's song! we're dancing to it for our high school dance revue,I love your guy's song! We dance for our high school dance magazine.
"done! thank you for the quick response, apparently faster than sitting on hold","It's done! Thank you for the quick answer, apparently faster than staying on hold"
cool picture of another virginamerica plane off our wing. what a site!,cool image of another virginamerica plane on our wing. What site!
keep up the great work,Keep the good work
my goodness your people field are amazing under pressure _ufrom texas in crisis please fly me to ny,my well-being your people field are amazing under pressure _ufrom texas in crisis please fly to ny
thanks for a great flight from la to boston! pilots did a great job landing in the snow. can we go back to la now?,Thanks for a great flight from boston! The pilots made a good landing in the snow. Can we go back to the now?
"thanks so much for the awesome support, you guys rock!","Thanks a lot for the impressive support, you guys rock!"
twitter team. you guys killed it for rescheduling me asap. thank you!,team twitter. You killed him for rescheduling. Thank you!
when are you putting some great deals from pdx to las or from las to pdx show me your love!,When you put good pdx stuff to las or pdx las to show me your love!
wish i can afford to fly with you next friday going back home.. love everything about your airline,If I could afford to fly with you next Friday back home. love all your airline
like,Like that.
you have the best flight attendant ever!!!,You have the best onboard agent!
"awesome! rt watch nominated films at 35,000 feet.","Great, look at the 35,000-foot nominees."
thanks so much!,Thank you very much!
the only airline based in silicon valley!,the only airline based in the silicon valley!
very nicely done. _uo,Very well done. - Yes.
iuam looking forward to watching the oscars on my flight home tomorrow. i might even get something bubbly to drink!,iuam is looking forward to watching the Oscars on my flight home tomorrow. I could even have something to drink.
hahaha _ua@virginamerica you guys are amazing. i love you guys!!!_uon,hahaha _ua@virginamerica you are amazing. I love you!
sounds like fun !,Sounds good.
"classiq, luv virgin america. greetingz","classiq, luv virgin america. salutationz"
thanks for your great customer service today &amp; for helping me get all my travel sorted out!,Thanks for your great customer service today and for helping me get all my trip sorted!
thanks guys! sweet route over the rockies,Thank you! gentle road on the rocks
love the 90s music blasting at gate in while waiting for flight to only if i could get an iced coffee!,Love the music of the 90s while waiting for the flight only if I could get an iced coffee!
"thank you for the easy itinerary shift for impending weather. quick, painless &amp; free.","Thanks for the easy route change for the imminent time. fast, painless and free."
thanks! good times there and back! the entire flight_uu#sfo,"Thank you, good times there and back! the whole flight_uu#sfo"
you're doing a great job adding little luxuries/aesthetics that improve the air travel experience. thank you. keep it up!,you do an excellent job by adding little luxuries/aesthes that improve the air travel experience. Thank you.
thanks for gate checking my baggage on your full flight dfw-lax 883 and giving me early boarding too,Thank you for checking the baggage door on your full flight dfw-lax 883 and giving me boarding too soon
i see what you did there,I see what you did here.
your inflight team makes the experience,your flight team experience
cutest salt and pepper shaker ever. just when i think you guys can't get any better you just do!,the most cut salt and pepper shaker. just when I think you can't get better than you do!
fav airline,fav airlines
we have a hot female pilot! sweet! dca to sfo!,We have a sexy female pilot! That's nice! dca to sfo!
thank you!!,Thank you!
would love to do more for virgin just like i do for,would have liked to do more for a virgin as I do it for
loved it. can't wait for monday's return flight... mostly just to watch the inflight safety video again.,I loved it. I can't wait for Monday's flight back. especially to watch the security video in flight again.
hi! just wanted to see if you have any new routes planned this year for newark. love flying you guys and hope to do so more!,Hello! I just wanted to see if you have new roads scheduled this year for newark. I love to steal you guys and I hope to do more!
"i mean. probably inappropriate while on board.. but, it's on!",I mean. Probably inappropriate on board. But let's go!
happy to spend the day together. let's do this!,happy to spend the day together. Let's go!
.@virginamerica they were very understanding and helped me out. thx!,@.virginamerica they helped me understand. thx!
thank you! i absolutely will _u_,Thank you! I'm going to absolutely u
how about some free drinks on the flight back for the free promo?,What would you say to drink free drinks on the flight for free promo?
thanks!,Thank you!
thanks!,Thank you!
thanks for taking care of on her flight!!,Thanks for taking care of his flight!
thanks for the lovely soft views! to,Thanks for the beautiful soft views! to
"i adore you, and am so looking forward to my flight to austin in two weeks.","I love you, and I can't wait to fly in a couple of weeks."
i was so glad it was mentioned. i took my first virgin flight a few years back and it was a transformative experience.,I was so glad he was mentioned. I took my first virgin flight a few years and it was a transformational experience.
"first time flying virgin, went to .thanks for the smooth ride. easily my new fav airline!","the first time virgin flying, went to . thank you for the right ride. easily my new airline!"
"just promoting the product is all, had a problem with southwest and recommend noneother than the best!","just promoting the product is everything, had a problem with the southwest and recommend nothing but the best!"
"love you guys, but pls get some direct routes las to aus!","I love you, but I have some direct routes to aus!"
of course! i work for and i'm obsessed with the entire virgin family!!,Of course! I work for and am obsessed with the whole virgin family!
ok! first time flying with you tonight,Okay! first time with you tonight
got it squared away. someone picked up as soon as i tweeted. should have tweeted sooner. _ua,I found him stuck. Someone picked up as soon as I tweeted. Should have tweeted earlier. - You're right.
ui@virginamerica: of course. have fun celebrating!u thanks! happy chinese new year!,ui@virginamerica: of course. Have fun celebrating! Happy Chinese year!
flight booking problems last second flight for next week from sfo- to san any chance you want to gift me a promo code since i love you guys,second flight booking problems for next week from sfo- to san any chance you want to give me a promo code since I love you guys
"for my grandma ella's 80th, she would &lt;3 a bday greeting from your flight crew! she was a stewardess for eastern airlines.","for my grandmother, she would have &lt;3 a day of salvation from your flight crew! She was a hostess for the eastern airlines."
just bought tix for atx - dallas route - thanks for adding that! love yr airline &amp; yr website is best transactional site ever,just bought tix for atx - dallas route - please add this! the best transactional site ever
gave a credit for my late flight flight yesterday. great service !!!! that's a wow moment! unexpected gesture!,I gave a credit for my late flight yesterday. great service !!!! It's a weird time! Unexpected gesture!
had me at their safety video . . . loved my first cross country flight.,had me during their security video. . . loved my first cross-country flight.
that doesn't look to fat to me! it looks yummy!,It's none of my business. It looks delicious!
omg omg_u_u nonstop dallas to austin on virgini_uiou,omg omg_u_u nonstop dallas à austin sur virgini_uiou
your planes are really pretty. just thought u should know that.,Your planes are really pretty. I thought I should know.
thank you,Thank you.
good to be home,Good to be home
"thanks for that. been needing a way to make those austin trips from dca, and now you've come through!","Thank you for that. I need a way to make these dca's fate trips, and now you've come!"
this is too cool! never been on ur planes but now i will!!,"It's so cool! I've never been on planes, but now I will!"
great. well deserved.,Great. Well deserved.
got it. all set - thanks!,Got it. - Thank you!
giants and virgin america. a match made in heaven.,Giant and virgin American. A match made in paradise.
"thank goodness!! also, see you friday, nwk&gt;sf.. boom!","Thank God! also, see Friday, indicative nwk;sf. boom!"
i luv ur people and product! 1 thing is y do u charge for herbal tea but not black tea? i'm not a caffeine drinker,"I drink people and produce! 1 thing is that you have the charge for herbal tea, but not black tea? I'm not a caffeine drinker."
thank you! see y'all soon! i'm excited to see the expansion of destinations. spread those wings!,Thank you! See you soon! I'm very happy to see the expansion of destinations. spread these wings!
has the most incredible customer service i've ever experienced! so refreshing!,has the most amazing customer service I've ever known! so refreshing!
", am i dreaming? did you really just open up a route between dallas and austin?! and does this mean houston might be next?",I dream? Did you really open a route between Dallas and Austin?! and that means that Houston will be next?
omg finally,omg finally
the dal-aus route makes my day!!!!,The road to the dal-aus is my day!
awesome deals dal-aus for only $39 each way!,Great business of the dal-aus for only $39 per way!
"love it, taking on in their backyard! consumers win when biz competes.",I love it. I'm in their garden. consumers win when biz competes.
uu is flying from love to austin now. that is most excellent news.,I'm stealing love in fate now. It's a great news.
congrats vx on the new route! iou_u_a,Congratulations to vx on the new road! iou_u_a
i am all about the in flight artisanal cheese and wine pairing.,I'm all on the artisanal cheese in flight and wine.
that's classy.,It's classy.
i'm sure a lot of your 747 and 777 jfk-lhr flights go a lot faster than 513mph with a strong tailwind.,I'm sure many of your flights 747 and 777 jfk-lhr go much faster than 513mph with a strong rear wind.
now it's just t-minus 32 minutes until my elevate a silver upgrade window opens . _ua_uo,Now it's just t-less 32 minutes until my student opens a silver upgrade window. ua_uo
would have been a rough trip but luckily we were on a flight.,"It would have been a difficult trip, but fortunately we were flying."
"another perfect flight. how come on your planes, the sun visors can stay down? other carriers make you raise them?","Another perfect flight. How is it that your planes, sunglasses can stay below? Other carriers are getting you up?"
"nice rt the man of steel might be faster, but we have wifi uo just saying.","the man of steel could be faster, but we have the uo wifi just say."
i love the dancing little richard. cool beans.,I love dance. fresh beans.
i donuat use passbook =/ i still love you though &lt;3 iuall just use my email in the future.,i donuat use passbook =/ I still like you that &lt;3 iuall just uses my email in the future.
thanks for the free birthday points! y'all are all right with me!,Thanks for the free birthday points! You're fine with me!
thanks so much for sharing. just added it to my site,Thank you very much for sharing. has just added it to my site
dad on segway is the best part of this whole infographic!,Dad on track is the best part of all this infographic!
are there any plans for a short haul airline in europe? would defiantly fly with you guys,Are there plans for a short-term transport company in europe? I'd fly with you.
wifi and better seating.,wifi and a better living room.
".@virginamerica not only was it great, but you return my calls the day after. couldn't ask for more.","@.virginamerica not only was it great, but you return my calls the next day. I couldn't ask for more."
"so loyal that i'm driving to from to fly virgin, since you cut flights","so loyal that I drive to the virgin, since you cut off flights"
you guys are perfect as always! &lt;3,You're perfect as always! &quot;3
thanks! y'all have some of the best customer service left in the industry.,Thank you! You all have the best customer service that stays in the industry.
really wish you'd fly out of those fares are amazings,"If you were stealing out of these prices, it's amazing."
just got on the 1pm in newark home to la. your folks at ewr are incredible,I came to newark at home. your parents to ewr are amazing
flying lax to sfo and after looking at the awesome movie lineup i actually wish i was on a long haul.,flying lax to sfo and after watching the super movie lineup I really wish I was on a long breath.
thanks,Thank you.
thanks for taking care of that mr!! happy customer.,Thank you for taking care of this gentleman! Happy client.
thanks -- we filled it out. how's our luck with this? is it common?,"Thank you, we filled it. How's our chance with that? Is that common?"
thanks,Thank you.
thanks. it is on the same ticket.,Thank you. It's on the same ticket.
follow me please this airline is beautifull a,Please follow me this airline is beautiful
just wanted to let you know how wonderful rosetta the gate agent was working flight 6457 dan to ase. let her know she wasappreciated,I just wanted to tell you how the marvellous rosetta the doorman worked 6457 dan to ase. She knows she was
"- thanks for your help...got me what i need, but its an issue with . i guess i sit awhile longer.","- Thanks for your help. gave me what I need, but his problem with. I guess I'll sit a little longer."
"""airport snow removal method keep up the good work folks, this is where cessna's become 747's!","""the method of snow removal from the airport keeps the good people working, that's where Cessna became 747's!"
thank you for that. am i able to claim any interim expenses or is the cost of the stuff up on me?,Thank you for that. Am I able to claim provisional expenses or the cost of things on me?
i flew united last month and the experience was awesome!,I stole one last month and the experience was great!
"441, which also had 1 working wc in coach. good thing this bird landed ahead of schedule. i have to use the wc stat.","441, who also had 1 wc in coach. It's a good thing that this bird landed before the schedule. I have to use the wc stat."
for the record- rozana at newark was lovely and helpful.,for the record- rozana in newark was charming and helpful.
thx for update,thx for update
despite my bag not making it to newark good informative email tracking updates help!,despite my bag not to do it to newark good informative email followed up updates help!
"wow. what a deal. again, 30+ plus seats available. easy change to make a customer happy.",What a deal. 30 more places available. easy change to make a client happy.
private jet would have been cool! do does not work. i'll try again,Private jet would have been cool! Doesn't work. I'll try again.
"thanks, just sent","Thank you, just sent"
"has unrivalled access to with flights to the u.s. from 7 uk airports, with nonstop or one-stop connections year-round","has unmatched access to flights to the u.s of 7 uk airports, with non-stop connections or a-stop all year round"
thnx for the info,thnx for news
kudos for not cancelled flightling flights from dfw this morning. united usually first to panic...,kudos for unrelied dfw flights this morning. First panic.
another awesome new plane flight 1584 and extremely nice captain steve connolly.,an impressive new plane flight 1584 and very pleasant captain steve connolly.
every united flight between saipan and guam is an adventure! you never know when old plane will be operational,every single flight between the sword and the guam is an adventure! You never know when the old plan is operational
thank you for the cheese platter and abundance of entertainment options. time just flew by.,Thanks for the cheese tray and the abundance of entertainment options. Time passes.
thank you. been trying for two days to set this up.,Thank you. I tried for two days to settle this.
definitely a compliment! i really thought my bag was lost after it was sent on to another airport. in the end i am a happy customer,A compliment! I really thought my bag was lost after it was sent to another airport. at the end I am a happy client
thanx so much. you followed through and emailed me a $1000 ticket voucher. they do care,"Too much. You followed me and sent me a $1,000 ticket voucher. They don't care"
"this will definitely be a trip to remember ewr-sti second of the season, first on seat 35a because it pays to be loyal!","It will certainly be a trip to remember ewr-sti second of the season, first on seat 35a because it pays to be loyal!"
you are one great airline _u,you are a great airline _u
ui@united: we'll see what we can do. ^knu we are running! most of this plane is running. thanks for the help!,ui@united: we will see what we can do. We're running! Most of this plane is running. Thanks for the help!
we just flew with united from aus (austin bergstrom) to cancun intl. best flight ever! the 737's are not too big... not too small!,We just stole with a pair of austin bergstrom to intl cun. Better flight ever! The 737 are not too big. Not too small!
"flight ua3576, gate b1. and tell ray i somehow made it on to the 736 flight out of iah and didn't have to wait for the 917 one.","flight ua3576, door b1. and say to strip that I did it on flight 736 of iah and did not have to wait 917."
but thanks for asking,but thank you for asking
you too!,You too!
is my favorite airline.,is my favorite airline.
man i can't wait to book my ticket now! thanks jp you're a life sabe,"I can't wait to book my ticket! Thank you, you're a life sabe."
you guys continue to impress me in houston.,You keep impressing me in a houston.
made the upgrade list. will fly 1st tomorrow (for 40 min) for the first time ever! _uai,made the upgrade list. the 1st tomorrow (for 40 min) for the first time! I don't know.
"not just refunded, but for those of us who are on vacation to get a free room night to make up for making us sleep in dia","not only refunded, but for those of us who are on vacation to get a free room night to make us sleep in dia."
thanks for the reminder. it's been a fun ride.,Thank you for the reminder. It was a fun trick.
terrific. many thanks. looking forward to being back on ua tomorrow. had a great flight up to vancouver.,Great. Thank you very much. I can't wait to be back tomorrow. I had a big flight to vanquished.
i appreciate your efforts getting me home!,I appreciate your efforts to bring me home!
"despite shaky connections, looks like i'll get home tonight. great job, - was touch and go for a while..",I'll be home tonight. A good job was touching and spending a while.
thank you.,Thank you.
thanks we'll be in touch!,Thank you for being in touch!
thanks to karen salisbury at iah for amazing customer service! found my daughter's bag lost on ua1516. made her day!,thanks to karen salisbury at iah for an incredible customer service! I found my lost daughter's bag on ua1516. She was on her day!
