0,1
thank you!! miss you all so so much!! is this the link to the blog? or has that changed?,Thank you! I miss you so much! is this the link to the blog? Or has it changed?
thank you!,Thank you!
to offer service from daytona beach to new york - albany business review,offer daytona beach service to new york - albany business review
no worries. delay was minor and dealt with nicely. it was captain of flight 2324 by the way.,No worries. the delay was minor and was settled well. He was the captain of flight 2324.
thanks! her flight leaves at 2 but she's arriving to the airport early. wedding is in vt in sept. grateful you fly to btv!!,Thank you! her flight leaves at 2 but she arrives at the airport early. Marriage is in seven. Thanks for flying to btv!
we were moved to a delta direct. thank you for the accommodations!,We were moved to a direct delta. Thanks for the accommodations!
well i did miss it. but gate agents had rebooked boarding pass waiting when i landed. time for lunch &amp; a beverage. easy cheesy,"I missed it, but the door agents had rebooked the boarding passage until I landed. hour for lunch and a drink. ease of failure"
thank you! i will be calling you!,Thank you! I'll call you!
"getting sorted, thanks","of sorting, thank you"
thank you!!,Thank you!
great job today from your team with a challenging weather delay on flight 1925 out of charlotte.,excellent work today of your team with a difficult weather delay on the 1925 flight out of cart.
thank you very much.,Thank you very much.
thanks !!!,Thank you!!!
i made it- thx.,I did.
i'm glad retweeted otherwise you would have to ignore the numerous tweets i sent. you all are fucking amazing,"I'm glad you're shrinking, otherwise you should ignore the many tweets I've sent. You're all amazing."
haha no worries you guys are the best! +1 for spelling my name correctly,You're the best! +1 for the spelling of my name correctly
see you on board tomorrow,See you on board tomorrow.
"waiting on my flight right now, thanks!!","I'm waiting for my flight, thank you!"
we're back at a gate. opposite of wheels up. im sure we'll get thete eventually. so thanks.,We're back at a door. in front of the wheels. I'm sure we're gonna end up taking it. Thank you.
knows customer service!! thank you for starting our 2 week vacay on an amazing note! thank you sarita!!!,Knows the customer service! Thank you for starting our 2-week vacay on an incredible note! Thank you.
excited that i'll be flying from syracuse to interview in dallas on friday for the fa position- this is a goal &amp; dream of mine!,excited that I steal from syracuse to interview in dallas on Friday for the position fa- it is a goal and a dream of mine!
"great crew for flight 504 phx to yvr tonight! friendly, efficient. awesome job.","super crew for the 504 phx flight to yvr tonight! friendly, effective. Great job."
thank you for your empathy there is more to this story than just the luggage but thank you for reaching out,"Thanks for your empathy there's more to this story than just the luggage, but thank you for reaching"
thanks very much! i got thru on the phone &amp; everything is fine. just love the website &amp; app ! thanks for working on it!,Thank you very much! I got thru on the phone and everything's fine. Love the site and the app! Thanks for working on it!
"by the grace of god, i made it! ui@usairways: we don't have those powers in here. we hope you can make that flight.u","by the grace of God, I did it! ui@usairways: we do not have these powers here. We hope you can fly this flight. u"
"no worries, your flight attendant took care of it.",Your flight attendant took care of it.
can you bring guinea pigs in small pet carrier onboard your flights?,Can you bring guinea pigs to a small luggage carrier on your flights?
good work by flight 1798 crew. recognition even in coach. too many late flightly. what's up with this?,good work by the flight crew 1798. Recognition even in coach. Too many late flights. What's going on?
thanks! sent you dm re: baggage issues.,Thank you! sent you dm re: baggage problems.
customer service at its best! rachel s. took great care of us at the phx airport.,customer service to its best! rachel s. took good care of us at the phx airport.
great management of twitter account. thank you.,a great management of the twitter account. Thank you.
it has been found thank you,He was found thank you
thank you for resolving the issue. on direct flight to sfo from,Thank you for solving the problem. in direct flight to sfo
ok thanks,Okay.
i'll check it out when i get to the airport. thanks.,I'll check when I'm at the airport. Thank you.
"thanks for the reply. on a good note, the pilot nailed the landing. seriously. kudos.","Thank you for the answer. on a good note, the pilot nailed the landing. Seriously. kudos."
4 great flights with no delays! thank you!,4 flights without delay! Thank you!
look out for flying rocks this time! it's a bird it's a plane! nah never mind it's just a rock...,Watch the flying rocks this time! He's a bird! It's just a rock.
owes tammy from the winston-salem call center for keeping me as a customer!,Tammy owes the Winston-salem call center to keep me as a customer!
i made it! thanks for the help!,I did it! Thanks for the help!
- huge props to parizad at checkin in sacramento for her help on friday to get 3 of us home when other airlines were delayed,- huge prostheses for parizad to registration in sacramento for his help on Friday to get 3 of us at home when other companies were delayed
shout out to diane at eyw for helping get us home today instead of tomorrow (even if a little late flight!),yell at the diane at eyw to help us get home today instead of tomorrow (even if a late flight!)
made it! just! huge relief - thanks for your help!,It's done! Just! enormous relief - thank you for your help!
"- thanks, i hope so. maybe you can put in a good word for me?",- Thank you. I hope so. Maybe you can tell me a word?
wow unbelievable how you treat your customers at puerto rico airport! _uo,amazing wow how you treat your customers at puerto rico airport! - Yes.
they were breathing very heavily. but were super helpful. thank you.,They breathed very strongly. But they were great. Thank you.
"okay, great. thank you!",Great. Thank you!
it was customer service like i have never seen before! kudos to your organization.,It was customer service as I've never seen before! nicknames to your organization.
we called and were able to get rescheduled. thank you for the quick responses today!!,We called and we were able to redirect. Thank you for the quick answers today!
over the phone. i called the 6170 number and she picked up almost immediately.,On the phone. I called number 6170 and she picked up almost immediately.
603 &amp; 2705 dfw to psp thank you!,603 &amp; 2705 dfw to psp thank you!
1899. thanks,1899. Thank you.
fyi your customer service rep carol is an absolute delight. so pleasant to with with and rebooked me in lightning speed! thanks!,fyi your customer service rep carol is an absolute pleasure. so pleasant to with and booked me at the speed of lightning! Thank you!
dominick l. at la guardia airport nyc gives the absolute best customer service! thanku! checking in made easy!,dominick l. at the guardia airport nyc gives the best customer service absolute! Thank you!
thanks for the information!,Thank you for the information!
couldn't be more thankful to your and crews on the ground and in the air today for help with a sick kid and a lost bag!,"You couldn't be more grateful to your crews and to the ground, and today in the air, for helping a sick child and a lost bag!"
thank you.,Thank you.
your clt baggage crew deserves a i had to run to make my connection. and my bags still made it!,your clt-packing crew deserves a I had to run to make my connection. And my bags have done it again!
thanks!,Thank you!
is alright with me. please give scott f at bdl a bonus for excellent customer service,It's okay with me. please give scott f to bdl a bonus for excellent customer service
ui@usairways: ou thank you for that elaborate response,ui@usairways: or thank you for this written response
you are the best!!! you are amazing!!! follow me please;)_ua_ua_ua,You're the best! You're amazing! Follow me please;)_ua_ua_ua
on a happy note our 719 crew is wonderful. can't say enough great things about our pilot. he's doing all he can for us.,on a happy note our 719 team is wonderful. We can't say enough awesome things about our pilot. He does everything he can for us.
"he's fine, he really likes picking his own seat....",He really likes to choose his own seat.
thank you. i'll do that next time!,Thank you. I'll do it next time!
looks like our bag has been rescued. thanks!,Looks like our bag was saved. Thank you!
since i am a loyal usair customer i am sure that they will make this up to me-right now i want to get home &amp; back to work.,"Because I'm a loyal usair client, I'm sure they're gonna catch me up, now I want to get back to work."
"- janet &amp; my den-phl flight cancelled flightled saturday, usair rescheduled automatically &amp; notified us by email at no additional cost.","- janet &amp; my flight den-phl cancelled saturday, usair reprogrammed automatically and notified us by email at no additional cost."
the entire flight crew on flight 738 from bos to phl is doing a wonderful job and making this experience not totally suck. _u_,the flight crew on flight 738 of phl bos does a wonderful job and do this not totally null experience. u
"major issues getting out of boston, but your crew has been exceptional. let's see how things roll out in philly.","major problems that come out of boston, but your crew was exceptional. Let's see how things go in philly."
thanks to the whole team for an on-time flight despite inclement weather,thanks to the whole team for an hour flight despite the weather
"great, thank you!","Great, thanks!"
it's not often that an airline is so easy to work with. i needed to change my flight time and the attendants at mke made my day!,It's not often that an airline is so easy to work. I needed to change my flight time and mke agents did my day!
another great flight thanks for showing my dad wonderful customer service.,another great flight thanks for showing my father service to the wonderful customers.
"thank you for a couple of easy, hassle free flights today, professional and friendly staff made everything easy!","Thank you for a few easy flights, without any trouble today, professional and friendly staff made it all easy!"
please keep emily at you gso airport ticketing on staff she is amazing,"please, keep the airport of gso ticket on the staff it is amazing"
provided the best service for me today! thank you so much,provided the best service for me today! Thank you very much.
"despite mechanical issues and many delays followed by a cancelled flightlation, still getting to vegas thanks to great gate agents!","despite mechanical problems and many delays followed by a cancelled vollation, always to the gas with large door agents!"
ann marie at lga is the best ticket agent ever!,ann marie at lga is the best ticket agent ever!
new f/as from dfw to clt this morning did a great job. well done!,new f/a from the clt dfw this morning did an excellent job. Well done!
"painless and effortless flight from indy to phl... our flight attendant, tory, was fantastic. give that lady a raise asap!","the painless and effortless flight from indy to phl. our on-board agent, tory, was fantastic. Give this lady a jump!"
thanks to the friendly us airways staff that helped me get booked on various flights to get home today. almost there!,thanks to the friendly airway staff who helped me to book on various flights to return home today. Almost!
"i finally spoke to a person. despite the mind boggling wait time, the rep was very pleasant and very helpful. kudos to her.","I finally talked to a person. Despite the waiting time of the mind, the rep was very pleasant and very useful. kudos for her."
mellani b. and whole team in columbia sc are absolute superstars. incredibly helpful.,mellani b. and the whole team in columbia sc are absolute superstars. incredibly useful.
"please thank mellie at cae, tammy in baggage claim at clt 4 customer service 2day, but i have a complaint.","Thanks to melie in the box, tammy in the clt 4 customer service 2 days, but I have a complaint."
on re-accommodation number lisa (liza?) in raleigh was very helpful,on the re-accommodation number lisa (liza?) to raleigh was very useful
"worked w/ tiffany h at cust service desk in charlotte and she was helpful and patient. still stuck, but she was great.","worked w/ tiffany h at the office hoop service and it was useful and patient. Always stuck, but she was great."
good morning.,Hello.
many thanks for your reply!,Thank you very much for your answer!
"job well done from your philly employee running check,in today. (tabitha?) helped us in an emergency &amp; vacation saved!!!","well done work of your philly employee at the recording, today. (tabitha?) helped us in an emergency and a saved holiday!"
thanks!,Thank you!
ok thank you! very helpful! this is why you're my favorite airline!,Thank you! Very useful! That's why you're my favorite airline!
thanks guys! got hold of someone. really awesome service i appreciate it,Thank you! I got someone. service really impressive I appreciate
first class service on us 769 phl-mco today from the flight attendant in f. i didn't catch her name but she was top notch!,"first class service on us 769 phl-mco today from the flight attendant in f. I didn't take her name, but she was upstairs!"
oh well. i'll get to cancun eventually.,"Oh, good. I'll go to the cun."
"eyyyy! cancelled flightlations, flight booking problemss, reflight booking problemss, but y'all got me on the same flight out tonight (not tomorrow) &amp; the fc upgrade. thx!","eyyyy! cancelled flights, flight booking problems, refresh booking problems, but you all have me on the same flight tonight (not tomorrow) and upgrade fc. thx!"
thank you!!!,Thank you!
"i wasnt flying your airline tonight, however a friend was and i was present for her help. i flying united and they could learn.","I was stealing your company tonight, but a friend was and I was there for his help. I fly together and they could learn."
the plane crew has been as professional and courteous as the gate agents were flustered.,the aircraft crew was as professional and courteous as the door officers were affected.
"your ticket agents at gate 4 in providence airport rocked tonight, especially kristy, sorry if that is not the correct spelling.","your ticketing agents at door 4 in the providence airport rocked tonight, especially kristy, sorry if it's not the correct spelling."
2 kristie(sp?) from gate4 pvd today. she's a was a tremendous help in a tough situation.,2 kristie(sp) of gate4 pvd today. she was a huge help in a difficult situation.
thank you for your help today. i have been a loyal us airways customer and i appreciate your responding to my tweets.,Thank you for your help today. I was a loyal customer and I appreciate your answer to my tweets.
an already pleasant flight from london to charlotte (us733) was made fantastic by an amazing attendant. thank you so much robert!,an already pleasant flight of carlotte london (us733) was made fantastic by an incredible accompanier. Thank you so much robert!
"woohoo! he still has 1 more flight but so happy to hear they're in the air, just about cried! (must be the preggo hormones!) thx!","Whoa! He's got another flight, but so happy to hear they're in the air, just about shouting! (you have to be preggo hormones!)"
thank you!!! this whole crew has rocked through bad weather and diversion. pilot keeping us well informed.,Thank you! The whole crew went through the bad weather and the hijacking. pilot keeping us informed.
i hope i get the opportunity to join the team with this job opening!,I hope I have the opportunity to join the team with this opening of work!
thank you! you have always been so good to me. i will follow up.,Thank you! You've always been so good for me. I'll follow.
no problem - he was the only person in the airport who would help,no problem - he was the only person in the airport who could help
"thank you! it's 1875 from bwi, keep seeing different stats, from delayed to awaiting take off to delayed...","Thank you! it is 1875 of bwi, continue to see different statistics, delays to take off to delay."
nick on flight 742 was awesome. please reward him in some way!!! he has kept us smiling on a bad day of travel.,nick on the 742 flight was great. Please reward him in a way! He kept us smiling on a bad day of travel.
sitting on a plane in philadelphia for over 20 minutes waiting just to get off the plane. great service!,sitting on a philadelphia plane for more than 20 minutes just waiting to leave the plane. Great service!
big thank you to your ticketing agent ute v at dulles-washington for outstanding guest service to get me rebooked,great thanks to your ticketing agent ute v to dulles-washington for the exceptional guest service to make me rebooker
i love you guys!!!,I love you!
can't wait for the trip. thanks for getting me there!,I can't wait for the trip. Thanks for bringing me there!
your team member at dca- tamara r. is her name was awesome. you should have more employees like her!,your team member at dca- tamara r. is his name was great. You should have more employees like her!
thanks for getting us on ur plane. awesome flight attendant who is making us smile after difficult travel.,Thanks for getting us on the plane. Super on-board agent that makes us smile after a difficult trip.
"stars aligned. connecting flight was delayed into clt. made it! thanks, glad to know someone is listening. time for 80a in mobay!","the stars aligned. the correspondence flight was delayed in the clt. It's done! Thank you, happy to know someone's listening. Time for 80a in mobay!"
a big thanks to the gate agent flt5127..keeping us informed of the delay#greatcustomerservice,a big thank you to the door agent flt5127. keep us informed of the deadline#greatcustomerservice
ok. thank you,Okay. Thank you.
"got it, thanks!",I'm sorry.
just spoke with a representative. moved my flight earlier. thank you so much for the follow up.,I just spoke with a representative. I moved my flight earlier. Thank you very much for the follow-up.
hey guys just want to say i had the best flight ever! thank you so much. i fell asleep and actually had a wet dream.,Guys just want to say I've had the best flight ever! Thank you very much. I fell asleep and made a wet dream.
"but don't worry! they found a hotel, it's only 45min away. i got there around 11:30pm, no problem.","But don't worry! They found a hotel, 45 minutes away. I arrived around 11:30, no problem."
kudos to robin at lost/found for reuniting me w/ my ipad. she was delightful to work with!,kudos to cobble to me to meet w/my ipad. She was very happy to work with!
experience exceptional service from cherry at,experience exceptional service of cherry to
me too!,Me too!
you can thank supervisor jeanine and her coworkers for the excellent customer service they provided,you can thank the Jeanine Supervisor and his colleagues for the excellent customer service they provided
yes i did thank you! they did a great job turning the flight in jan !,"Yes, thank you! They did a good job turning the flight into jan!"
connection made. thanks again this week.,connection made. Thanks again this week.
thank you,Thank you.
yes thank you. appreciate u checking...,"Yes, thank you. Thank you for checking."
"i'm enjoying my flights so far! you're doing a great job. today's been tough, so thanks for making my flights comfortable.","I take advantage of my flights so far! You're doing a good job. Today, it's hard, thank you for making my flights comfortable."
shavon at customer service desk in charlotte was fantastic! so helpful and smiling evn after what sounds like long day.reward her,carlotte customer service was fantastic! so useful and smiling evokes after what sounds like a long day. reward her
- check-in staff at phx are awesome! great traffic control for general boarding.,- Phx recording staff is great! large traffic control for general boarding.
just talked to reservation. must congratulation to them. very friendly. good for usair. the only airline we fly.,I just spoke to the reservation. We must congratulate them. Very nice. It's good for us. The only airline we fly.
awesome! flight out of philly on tuesday. party in row 15 if you're interested.,Great! philly flight on Tuesday. party in row 15 if you're interested.
i got through and am able to switch my flight with no charge. thank you,I've been through and I'm able to change my flight at no cost. Thank you.
welcome to north texas us air / american air employees. housing and education are great opportunities in the gr8 state of texas,welcome to the north texas we used air / air American. housing and education are great opportunities in the state gr8 of texas
"thanks. no dc yet, i see. i will keep that link and check back. appreciate it!","Thank you. Not yet, I see. I'll keep this link and check it out. Thank you!"
"awesome! and yes, is!","Great! And yes, yes!"
melinda in reservations in greensboro nc is an absolute jewel thank her for me she's amazing!!!,melinda in bookings in greensboro nc is an absolute jewel thanking her for me she is amazing!
best gagent in a long time - danny b. for us628 dfw-clt. appreciated how up to date he kept us during irrops. super professional!,best gagent in a long time - danny b. for us628 dfw-clt. I enjoyed it so far that he kept us during the irrops. Super professional!
"good news, we got fixed.","Good news, we've been fixed."
thank you!,Thank you!
thank you,Thank you.
reservation agent on the phone did a great job.,The booking agent on the phone did a great job.
made it!!! send bloody mary's to row 27!!!,It's done! Send the mary to line 27!
thanks for helping with booking problems flightedflight yvonne anthony. you will help us get to tel aviv on time.,Thanks for helping with the booking problems voledflight yvonne anthony. You'll help us make such a living in time.
big thanks to yvonne anthony from the chairman's desk. top tier customer service today. &amp;,Thank you very much to yvonne anthony from the president's office. high-end customer service today. &amp;
i appreciate your prompt response.,I appreciate your quick answer.
thks us 2/19 phl to fll. overall 1st class has improved with more food now on phl to fll and most crews are super.,we sink 2/19 phl to fll. the first global class has improved with more food now on the phl to fll and most crews are great.
thank you for refunding me on my baggage ! really appreciate it,Thank you for paying me back on my luggage! really enjoy
i am so going to miss us airways. you always provided great service and never let me down.,I'm gonna miss you so much. You've always provided excellent service and never let me down.
we will...sunday! just a few days away,"Sunday, a few days."
"ui@usairways: we're excited to have you fly with us, jb! when will this be?u spring break !!!","ui@usairways: we are delighted to have you fly with us, jb! when will it be? u spring break !!!"
i will. thank you for at least tweeting me back:) better than most. _uoi,I will. Thank you for having at least tweeted:) better than most. _uoi
exicted to be flying with y'all soon !!,Exicted to fly with you soon!!
fa attendant on 4553 phl to pwm tonight was fab! an asset to your team. from 1f. have a great night team!,"A little 4553 to pwm tonight, it was fab! an asset for your team. from 1f. Make a great night team!"
we're having 2 grandbabies in 2 weeks -- will travel to dc for the births. thank you for the reasonable fares! see you saturday!,We got two little babies in two weeks - we're gonna go to dc for births. Thank you for reasonable prices! See you on Saturday!
"thank you, your fare to from dtw to dca was much lower than and thank you! you won me over!","Thank you, your rate from the dtw to the dca was much lower than and thank you! You won me!"
"i know that, thanks. evaluate further ... -chairman","I know that, thank you."
thanks for getting me rescheduled on a direct flight to nola tonight in 10 minutes--and hopefully an hour earlier getting there!,Thank you for redirecting me to a direct flight to Nola this evening in 10 minutes and I hope that an hour will arrive!
thank you finally got our bag. customer services reps were wonderful.,Thanks for finally getting our bag. Client service representatives were wonderful.
flight 437 phx&gt;ord. lead fa bill is the most professional fa i have seen in 9 years of flying usair. i have no ab cards.,flight 437 phx constantgt;ord. lead fa invoice is the most professional fa I've seen in 9 years of usb flight. I don't have cards.
i miss you too. work has taken me out of philly. iuave been on flight 1776 from bos uo&gt; phl so many times i should have a res. seat,I miss you too. The work made me out of philly. iuave was on flight 1776 from bos uo biasgt; phl so many times I should have a seat.
no problem. things worked out at airport. thanks!,No problem. Things worked at the airport. Thank you!
"yes, it's a domestic flight. thank you!","Yes, it's an internal flight. Thank you!"
thanks! made it safely!,Thank you! It went well!
"- love the changes in the lounge - cheese, veggies, olives in addition to the crackers and snack mix,","- love the changes in the living room - cheese, vegetables, olives in addition to crackers and the snack mix,"
thanks. if you have another method also that would be nice. appears to be a design flaw,Thank you. if you have another method too that would be nice. seems to be a design defect
lol me too,lol me too
